author,content
jordanbpeterson,"I'd say shed the mask, actor."
jordanbpeterson,Let's get those female lumberjacks and fishermen paid!
jordanbpeterson,Not good.
jordanbpeterson,"That truth was inescapable twenty years ago @sunlorrie still, glad you continue trying to clue people in"
jordanbpeterson,Successful means Latvia remains functional despite the visit ⁦@JustinTrudeau⁩  https://t.co/dsfjzTMFQw
jordanbpeterson,Whoever wrote this tweet should be absolutely ashamed @jk_rowling
jordanbpeterson,Better than Venezuela @POTUS
jordanbpeterson,UK media trash Trudeau for using Putin tactics in convoy crackdown https://t.co/lmz1kFRbyM via @truenorthcentre
jordanbpeterson,Retired judge GIESBRECHT: Trudeau has irreparably damaged our country | Toronto Sun https://t.co/XV1DxCxRC7
jordanbpeterson,Rex Murphy: 'Slippages' in democracy? Justin Trudeau knows a lot about that https://t.co/ofD7kHQeMI via @nationalpost
jordanbpeterson,Bill 67 promotes precisely the opposite to what conservatives hold dear. Why are you falling for this @fordnation ? Pay attention @PremierScottMoe @jkenney @PierrePoilievre @CandiceBergenMP this sets a very very bad precedent
jordanbpeterson,I wish this failed to surprise me.
jordanbpeterson,This could happen to you a lot more easily than you likely presently think https://t.co/uqIe9naECt
jordanbpeterson,Disturbing.  https://t.co/pHO8cjQeBY
jordanbpeterson,"No @CBCNews $4 per litre gas is coming and it's certainly thanks in no small part to your endless, moralizing state/financed propagandizing"
jordanbpeterson,"From a so-called news agency, with their so-called journalists."
jordanbpeterson,One acronym: ESG: think again @brianlilley
jordanbpeterson,Our international star...   @JustinTrudeau
jordanbpeterson,Seize the moment. How early-20th-century of you @pmarca
jordanbpeterson,"""not minor"" she should have recused herself from the case too."
jordanbpeterson,"Just wait until interest rates rise further.... and energy prices... and food prices, due to fertilizer shortages"
jordanbpeterson,"I'll bloody well bet he didn't ""offer any specifics."" https://t.co/v4TThQbmo7"
jordanbpeterson,Canadian PM @JustinTrudeau has done everything possible given his staggering incompetence and mendacity to make such reliance necessary and morally proper.
jordanbpeterson,Nothing is ever sufficiently obvious in such matters @elonmusk
jordanbpeterson,Yes.
jordanbpeterson,How can conservatives be so consistently and utterly self-defeating?  It's a constant source of amazement...
jordanbpeterson,Madness.
jordanbpeterson,Why in the world @fordnation is this possibly happening on your watch?
jordanbpeterson,"Yeah, but what does @elonmusk know? Oh, wait...."
jordanbpeterson,Isn't it something when the absolutely predictable happens @sunlorrie
jordanbpeterson,"Freeze their bank accounts. Oh, wait...."
jordanbpeterson,Trudeau Gives A Masterclass In Gaslighting https://t.co/h2d1JGLQCG
jordanbpeterson,"""Professors have noticed a shift in their classrooms."" A little late, there, boys and girls.  https://t.co/7lYHz3UPZa"
jordanbpeterson,The Dawn of Uncivilization https://t.co/muQ8xUGYpM
jordanbpeterson,Carr On Comedy | Jimmy Carr | The JBP Podcast | #233 https://t.co/mo4XSdbCWn via @YouTube @jimmycarr https://t.co/edx8ARTJj6
jordanbpeterson,"Great to have @jimmycarr on the podcast discussing comedy and truth.

https://t.co/mo4XSdbCWn https://t.co/hvV35xFnTd"
jordanbpeterson,Russell Brand @rustyrockets asks the hardest questions https://t.co/6e8joTLKm7 via @YouTube
jordanbpeterson,This should be a bombshell: Treatment with Ivermectin Is Associated with Decreased Mortality in COVID (compared to Remdesivir)  https://t.co/F7JbLO5Efo
jordanbpeterson,What do you think @POTUS
jordanbpeterson,My dream about kings and the king of kings https://t.co/Y4bGDQdlz1 via @YouTube
jordanbpeterson,"A course in induced body dysmorphia masquerading as woke enlightenment, safety and, worse, education @TDSB_ForestHill"
jordanbpeterson,"It's far beyond merely batty. It's appalling. ""Bind safe"" is a contendor for the most egregious contradiction in terms I have ever encountered."
jordanbpeterson,"Free speech means all voices have the opportunity to be heard. Join me on Parler, where free speech allows open and honest debate. - https://t.co/GdTSBLipaw https://t.co/34oj3znr0l"
jordanbpeterson,"A justification for life's suffering.

Subscribe to my newsletter via the link to be notified of my latest podcast release, new videos, and exclusive updates: https://t.co/ZYlO5Szt4H https://t.co/qYc4vjeUVI"
jordanbpeterson,"Thanks for clearing this up: what does ""demigender"" mean? https://t.co/0SkpyyBHbi https://t.co/TtBi2xf6Mr"
jordanbpeterson,Been there. Done that.
jordanbpeterson,Welcome to the brave new world of authoritarian compassion.
jordanbpeterson,Billions so far.
jordanbpeterson,On Western dependence on Russian petro https://t.co/nl19nwgDBl
jordanbpeterson,It's coming. We want to make sure it's reliable. Thanks @oldungurkallar
jordanbpeterson,Why stop something stupid when you've started it?
jordanbpeterson,We learned how by practicing on truckers.
jordanbpeterson,Looks like we've managed this about as well as we've managed energy and tech  https://t.co/cW0MbUCD5F via @nationalpost
jordanbpeterson,"‘Woke’ therapy will destroy psychotherapy, which must by its very nature be exploratory, rather than, say, affirming. On ALL issues. It's not up to the therapist to affirm. Or to deny. But to discover.  https://t.co/R6UGDtcF3z"
jordanbpeterson,No @jkenney time to eliminate ESG altogether.
jordanbpeterson,"""we"""
jordanbpeterson,Why listen to @elonmusk when we have petulant apocalyptic teenagers to guide us?
jordanbpeterson,"There has never been a more merit based enterprise than research science. Ever. Period. And we're going to destroy it with baseless, appalling and falsely virtuous accusations. Like those expressed in this ""scientific"" article https://t.co/vsfEx0y6vn https://t.co/vsfEx0y6vn"
jordanbpeterson,"""a bit of a slippage in our democracies"" says someone unprecedentedly slippery running a once-stellar democracy. ""Countries allowing misinformation..."" Why can't people see this farcical actor for what he is? And what he is not? @JustinTrudeau"
jordanbpeterson,Disagreeableness and truth. From the Valentine's Day episode with Tammy. You can take the test yourself or with a partner and compare scores here - https://t.co/sGEEviLent https://t.co/VOcb91YSIm
jordanbpeterson,Yes @POTUS
jordanbpeterson,Airbnb provides support in Ukraine https://t.co/aKdcZvJwKb
jordanbpeterson,Yes. Most definitely
jordanbpeterson,If they were real journalists they'd be ashamed to claim under-siege status. What a disgrace.
jordanbpeterson,See https://t.co/1fwTec5vUx https://t.co/X6nxJ0zR4r
jordanbpeterson,"""dominance"" is not a big five trait Rob @robkhenderson what's the evidence for its construct validity? Is it assertiveness, and therefore extra version?"
jordanbpeterson,"""Equity"" in such contexts inevitably means equality not of opportunity but of outcome."
jordanbpeterson,"Do you suppose this has anything to do with shutting the world down for 18 months? Or with prioritizing green moralizing over prudent decision-making (Germany, UK, US, Canada). And now people will go hungry.  https://t.co/IxMZ4xxhaw"
jordanbpeterson,Stunning. Things could be very good if we weren't so hell-bent on making them worse.
jordanbpeterson,Highly unlikely.  But good and necessary for Canada and those who will come to depend on our energy sources.
jordanbpeterson,Aren't the Europeans the fortunate ones.
jordanbpeterson,"I ca't believe that this bill is spearheaded by conservatives. Don't you know that ""equity"" is a word that means everything antithetical to a genuine conservatism? https://t.co/79QquWGYX9 @fordnation @DouglasKMurray @jkenney @PierrePoilievre @CandiceBergenMP @PremierScottMoe"
jordanbpeterson,I’m looking for a Ukrainian government official interested in describing the current climate in Ukraine for a podcast with my daughter @MikhailaAleksis.
jordanbpeterson,An attempt to have a different kind of discussion about race: Theory of Enchantment | Chloé Valdary | The Jordan B. Peterson Podcast S... https://t.co/GPEljHxPws via @YouTube
jordanbpeterson,Hell... https://t.co/lY4mJNSMq1
jordanbpeterson,Cat snake tree bird fire https://t.co/r7aEdalMZu
jordanbpeterson,Ukraine Update | Frederick Kagan | The JBP Podcast | #231 https://t.co/wvCTJN8dDx via @YouTube https://t.co/qKngSy36XC
jordanbpeterson,garden Eden paradise milk honey heaven https://t.co/ggFg5x0Y9o
jordanbpeterson,"Has our culture has reduced the cost of false accusation, innuendo, and unwarranted insult to zero? Is that the fundamental problem with social media? Who pays the cost for ""free"" communication?"
jordanbpeterson,AI-generated art to prompts: truth beauty justice love courage nobility excellence heroism judgment wisdom from Wombo dream: entitled Virtue #01 https://t.co/x2UgOOe6sh
jordanbpeterson,Opposing Views: Islam - The End of Europe? | Mohammed Hijab &amp; Ayaan Hirs... https://t.co/3xUmd2LLBz via @YouTube
jordanbpeterson,But it will hypothetically reduce the warming of the planet by some tiny and technically unmeasurable amount at some indeterminate time in the unforeseeable future.
jordanbpeterson,Notes backstage before my lecture in Durham tonight from Rule 9 of Beyond Order: try to make one room in your home as beautiful as possible https://t.co/Zu2T5tK5ne
jordanbpeterson,"""against drilling"" and ""for embargoes"" means against the working poor. Period."
jordanbpeterson,Nope.
jordanbpeterson,"We're so stupid. Hence, we're much poorer than we could be. And it's just not helping the planet. Despite the insistence that it is."
jordanbpeterson,"Similarly, you cannot maintain trust in your partner if he or she lies, or betrays you in action or in silence.
 
So, the vow that makes a marriage capable of preserving its romantic component is first and foremost the decision not to lie to your partner. (3/3)"
jordanbpeterson,"The first of those requirements is truth. 

You cannot maintain trust in yourself if you lie. You cannot maintain trust in yourself, likewise, if you act in a manner that would require a lie if it was discovered. (2/3)"
jordanbpeterson,"Romance requires trust—and the deeper the trust, the deeper the possibility for romance.

But trust has its requirements, as well.

Apart from the courage required of the individuals wise enough to distrust, but brave enough to risk putting their faith in a partner. (1/3)"
jordanbpeterson,"Define ""status"" @robkhenderson"
jordanbpeterson,Isn't it something when the absolutely inevitable inevitably materializes @sunlorrie
jordanbpeterson,"Rob, I think that Korea is a anti-narcissistic culture and so sets the border for self-congratulation regarding industriousness much higher @robkhenderson"
jordanbpeterson,Some of the hypocrisy. By no means all of it.
jordanbpeterson,But we'll likely do it anyway because the planet.
jordanbpeterson,Yes. Progress. More of this please @POTUS
jordanbpeterson,Yes.
jordanbpeterson,This is utterly inexcusable and cruel.
jordanbpeterson,"""at capacity"""
jordanbpeterson,Some sections from Beyond Order Rule 8 that I'm rereading in preparation for tonight's lecture in Durham: try to make one room in your home as beautiful as possible https://t.co/RaTH21Q6BF https://t.co/WfdoLNP5Vd
jordanbpeterson,So pleased to hear this @GovRonDeSantis
jordanbpeterson,Journalist Barbara Kay is always worth attending to https://t.co/7n0dJAZqXP
jordanbpeterson,Ouch.
jordanbpeterson,The woke assault on STEM continues unabated https://t.co/uCWBNkljmM
jordanbpeterson,"An account with a debate with the current editor of Science, once the world's greatest scientific journal https://t.co/brIaD6geJl https://t.co/B8dRx8XkNC"
jordanbpeterson,This is an extremely important article. ESG is false virtue on a whole other scale. ESG regulations are a catastrophe: DEI expanded to an almost unimaginable level. With everything that implies.  https://t.co/8r5e7bQMgL
jordanbpeterson,The Problem with the Diversity Dividend https://t.co/8r5e7c8n8j
jordanbpeterson,"Expect a lot more of this. Because we don't have any petro resources in Canada. oh, wait @JustinTrudeau"
jordanbpeterson,This is a rough thread.
jordanbpeterson,Subtext: we're poor and weak because we're stupid. True.  https://t.co/GckAfNZcD9
jordanbpeterson,Beware of this. It will be used against you.
jordanbpeterson,"I bet they're funded by Canadian misogynists, bigots and fascists hell bent on destabilizing American Democracy."
jordanbpeterson,What do you get when you multiply two virtue signals together ? We're about to find out.
jordanbpeterson,"""entitled"": that about sums it up."
jordanbpeterson,Kelley's Heroes from @RobertsWWorld Robert's Western World closed my lecture at the Ryman @theryman tonight in Nashville. They nailed it. Ghost Riders and The Star Spangled Banner. Thanks guys. https://t.co/Xyhji82hHq
jordanbpeterson,You can now find me on @parler_app - Go to https://t.co/GdTSBLipaw to join me there.
jordanbpeterson,Rule 7 tonight in Nashville: Work as hard as you possibly can on at least one thing and see what happens. From Beyond Order https://t.co/RaTH21Q6BF https://t.co/5LlkxvXMK6
jordanbpeterson,The faculty slowly awaken... https://t.co/G0WZLbUaQC via @collegefix
jordanbpeterson,"Just remember to ask yourself: who defines ""hate crime?"" And the answer always is: precisely those people you would least trust to do so. 

""rise in hate crimes""

says who you propagandists and woke authoritarians @globeandmail"
jordanbpeterson,https://t.co/dtTTsTCLlU
jordanbpeterson,Witch hunters have to hunt witches. Beware of being labeled a witch...
jordanbpeterson,More of this please.
jordanbpeterson,Because no excuse is too trivial to justify the continued use of unreasonable compulsion.
jordanbpeterson,"Obviously. Obviously. Obviously. And the fact that she didn't is scandalous--or would be, in normal times, when we're not so flooded by scandals that we can hardly notice another."
jordanbpeterson,Watch here - https://t.co/ITLJyGny9h
jordanbpeterson,"Divorce and Custody.

From my podcast episode with @ellisgreg https://t.co/UtkrlOMHjx"
jordanbpeterson,Oh no global cooling.
jordanbpeterson,Congratulations congressman @DanCrenshawTX
jordanbpeterson,Home schools fix this.
jordanbpeterson,What gives with the cold shoulder to @elonmusk @JoeBiden
jordanbpeterson,Never again.
jordanbpeterson,Oh no it's a coup.
jordanbpeterson,Very funny: *Watches Jordan Peterson Once* https://t.co/qmo3VAXLyl via @YouTube
jordanbpeterson,Good @jkenney
jordanbpeterson,Here's a shock.
jordanbpeterson,Child abuse.
jordanbpeterson,The iron law of unintended but in this case absolutely predictable consequences (think Keystone cancellation) ⁦@jkenney⁩ ⁦@POTUS⁩ ⁦@JustinTrudeau⁩  https://t.co/Ba39Vz2dis
jordanbpeterson,"""science"""
jordanbpeterson,Backstage prep notes for tonight in Atlanta: Rule 6 from Beyond Order: Abandon Ideology https://t.co/RaTH21Q6BF https://t.co/mAg0udquFG
jordanbpeterson,"If you can face something voluntarily, rather than having it chase you, it's way better for you psychophysiologically. https://t.co/NS0LjG16Pg"
jordanbpeterson,"On the mediocre, punitive and controlling faux-glitterati of Canada: https://t.co/UPOsiIcsMp"
jordanbpeterson,"""liberating"" you self-flattering moralizers and fakes @mcgillu and your accusations of racism and presumption not of innocence but of guilt."
jordanbpeterson,"Any university that trumpets ""decolonizing"" research has adopted an explicitly anti-science ethos. Period. Appalling @mcgillu"
jordanbpeterson,They just can't quit using compulsion even now.
jordanbpeterson,"Russia, Ukraine, and the West | Frederick Kagan | The JBP Podcast | #230 https://t.co/RQWsYr3y8t via @YouTube"
jordanbpeterson,https://t.co/z8qvTCyKfF
jordanbpeterson,Thank the universities: Use of ‘sexist’ and ‘racist’ in the New York Times increased over 400% since 2012.  https://t.co/ysOrzVgave
jordanbpeterson,These can be avoided.
jordanbpeterson,It took an invasion to force attention to the blazingly obvious.
jordanbpeterson,"Reliable but ""dirty"""
jordanbpeterson,"""may"""
jordanbpeterson,More of this please @jkenney
jordanbpeterson,If Kimberle Crenshaw doesn't agree with it = racist.
jordanbpeterson,A leader with courage. Contrasted painfully with @JustinTrudeau fleeing the truckers he demonized.
jordanbpeterson,Beyond Order soon available in Turkish. https://t.co/M7WWpCIHIt
jordanbpeterson,"with @criticalthreats Director, Dr. Frederick W. Kagan."
jordanbpeterson,"Progress, Value and Knowledge From Tradition https://t.co/ZFwzHJmzpr"
jordanbpeterson,This seems reassuring: Ketanji Brown Jackson endorsed by Republican legal heavyweight - Axios https://t.co/yJV5HRDaUi
jordanbpeterson,The sooner the better @CBC
jordanbpeterson,"""suddenly"" says @globeandmail pointing to something many people have been shouting from the rooftops (in Alberta not least) for years @jkenney"
jordanbpeterson,A comment from a viewer https://t.co/S5WZTVPdnC
jordanbpeterson,"Russia, Ukraine, and the West | Frederick Kagan | The JBP Podcast | #230
https://t.co/RQWsYr3y8t https://t.co/YHwbEorNf5"
jordanbpeterson,That's a lot.
jordanbpeterson,Movement forward. New CDC Covid-19 metrics drop strong mask recommendations for most of the country - CNN https://t.co/6ADtbtgrPR
jordanbpeterson,What a contrast between Trudeau and Zelensky https://t.co/NC0XQ3D3ac via @wr_record
jordanbpeterson,Will reason actually prevail? All it took was an invasion...
jordanbpeterson,So good to have you along Mik. Thanks for everything @MikhailaAleksis
jordanbpeterson,You can now find me on freedom of expression social media @parler_app here - https://t.co/GdTSBLipaw https://t.co/fXrgJ3PMTx
jordanbpeterson,You can now listen to my song 'Wake Up' on Spotify - https://t.co/EOSY0ZkuQU
jordanbpeterson,"Pareto Distributions. 

From my appearance on @ChrisWillx podcast 'Modern Wisdom' https://t.co/5gvMw1wEsT"
jordanbpeterson,And this is trending on twitter #rexmurphy Rex Murphy: Trudeau's inexplicable use of the Emergencies Act must not be forgotten https://t.co/BAyUdG49bT via @nationalpost
jordanbpeterson,I think that this strategy actually made it more difficult for her nomination to proceed forward in the optimal manner and that this was neither wise nor necessary
jordanbpeterson,and allowing the nature of those accomplishments to be subject to the sort of political debate that will necessarily and should accompany such a nomination
jordanbpeterson,"I do nonetheless believe that the WH and @potus made an egregious error announcing race and sex requirements, and then announcing the candidate, rather than putting forth Jackson on the basis of her obvious merits and letting her accomplishments speak for themselves..."
jordanbpeterson,"Having said that: the new nominee, Judge Ketanjji Brown Jackson, is in fact a highly credible candidate: Harvard undergraduate and Harvard Law; editorship of the Harvard Law Review, as well as a public defender, a comparative rarity for such the possible holders of such positions"
jordanbpeterson,I was irritated about this tweet: https://t.co/Nh7phBE4Yj and laid out a string of arguments about why in a thread there
jordanbpeterson,https://t.co/K2usOuNXpg
jordanbpeterson,"Is it okay to lie for the greater good?

From the Jordan B. Peterson podcast with guest @TOEwithCurt. Episode linked below. https://t.co/quVVzUzXbd"
jordanbpeterson,"NEW 2022 tour date:

Nov. 29th – Perth, AUS.

https://t.co/QnuMcVi1rz https://t.co/BB1IbFub4d"
jordanbpeterson,"NEW 2022 tour date:

Nov. 26th – Melbourne, AUS.

https://t.co/Q6nuGTEsVt https://t.co/HKzlK8l2vG"
jordanbpeterson,"NEW 2022 tour date:

Nov. 27th – Adelaide, AUS.

https://t.co/4dAf0kVvuj https://t.co/jiy7hODn7p"
jordanbpeterson,"NEW 2022 tour date:

Nov. 25th – Sydney, AUS.

https://t.co/yFNPxfUT4W https://t.co/xwXFwYuY6R"
jordanbpeterson,"NEW 2022 tour date:

Nov. 23rd – Brisbane, AUS.

https://t.co/LlZ9GWtEHA https://t.co/ltrNCb5RLv"
jordanbpeterson,"NEW 2022 tour date:

Nov. 19th – Auckland, NZ.

https://t.co/0XT8XvU2zJ https://t.co/VPETJJHBX9"
jordanbpeterson,"NEW 2022 tour date:

Nov. 17th – Christchurch, NZ.

https://t.co/7NSePwmFvq https://t.co/0JMrlxz5o4"
jordanbpeterson,"You could come right out and say ""even given all that it was time for a (insert race here) x (insert sex here) candidate"" but then don't hand-wave injudiciously about excellence uber alles and expect kudos for your performance."
jordanbpeterson,"Finally, you might say ""the pool selected a priori was still large enough to ensure sufficient excellence."" This just means you don't understand the Pareto principle or the consequences of the power laws governing the manifestation of the highest levels of competence."
jordanbpeterson,"Furthermore, after doing all that, you then stated that your choice was in fact guided by the desire to use the appropriate indicators of competence, whose existence you obviously recognized to begin with (or else you couldn't have listed them)."
jordanbpeterson,"It follows, therefore, that you are either ignorant of the consequences of what you are doing, or lying to yourself and/or the people you serve. Or some combination of all three."
jordanbpeterson,"No, you didn't. You announced publicly that you would limit the search to a specific race and sex. You eliminated the vast majority of qualified candidates from consideration. And it is thereby virtually certain, technically, that you failed to pick the strongest candidate."
jordanbpeterson,"""Did our country and government a great service stealing"""
jordanbpeterson,With Chris Williamson @ChrisWillx Your Life Is Built For More (4K) | Modern Wisdom Podcast. https://t.co/dFrQWIsNDE: a very positive response from viewers and listeners.
jordanbpeterson,It's beyond belief that this ever happened or that it took so long to address.
jordanbpeterson,"Ralston College, a new educational initiative based in Savannah, in The Economist this week https://t.co/RnCV6kZE1F Pushback at cancel culture is leading to new educational initiatives https://t.co/mzk5Zhkubc"
jordanbpeterson,"We'll, she looks like she can play the part. And that's what matters. Intersectionality rules! Competence is a ruse!"
jordanbpeterson,Even the ⁦@globeandmail⁩ is turning on @justintrudeau: Polite no more: The world sees Canada very differently now https://t.co/SbnIF4bzBE
jordanbpeterson,All of Canada could have this. If we had the political will.
jordanbpeterson,It was @TorontoStar
jordanbpeterson,"It's alll in a good cause, though @jonkay, right? It was an emergency."
jordanbpeterson,"So much for the ""foreign-financed coup"" narrative which was utterly preposterous in any case @JustinTrudeau"
jordanbpeterson,Inexcusable. Theft. Mandated government-bank collusion. A blow to the integrity of state and financial institution alike @cafreeland @JustinTrudeau
jordanbpeterson,"A thought on Russia (and this is a thought, not a strategy): Attributed to Napoleon Bonaparte: never interrupt your enemy when he is making a mistake."
jordanbpeterson,About 20% of these tickets sold on the first day of their release so if you are thinking of going perhaps consider not delaying your purchase too long....
jordanbpeterson,and on Apple Music: https://t.co/Y2rqE6kbA1
jordanbpeterson,"Wake Up, the song my team and I wrote and recorded and dedicated to @JustinTrudeau is now available on Spotify: https://t.co/NaCTIsoldM"
jordanbpeterson,"Tickets to my Australia and New Zealand shows are now on sale, go to https://t.co/EPVLHTF18W to get your tickets. https://t.co/mZ5bH0gGA9"
jordanbpeterson,"If people are impeding your development, you sacrifice your relationship with them. https://t.co/PjTTJVkoIg"
jordanbpeterson,"Fascism, defined by Mussolini: the collusion and unification of corporation and government. Press perhaps foremost among them."
jordanbpeterson,"It's just MIT, folks, mindlessly following their idiot peers, placing image over substance &amp; the illusion of compassion over true ethical striving https://t.co/jehrnS3kuT. Who needs quality engineers? Oh yes, Russia and China. And that's no f**king joke. https://t.co/wY95vN4I4u"
jordanbpeterson,GQ journalist Helen Brown's contentious  interview with me approaches 50 million views https://t.co/gAmhhVTRQa Channel Four's Cathy Newman has slipped to a clear second place over the years with only 36 million.
jordanbpeterson,Expect a lot more of this.  https://t.co/wXqhSyXvwY
jordanbpeterson,"God, Consciousness, and the Theories of Everything | Curt Jaimungal JB Peterson https://t.co/K2usOuNXpg @TOEwithCurt very positive audience reaction"
jordanbpeterson,Are you at MIT tomorrow @lexfridman
jordanbpeterson,"Is @elonmusk the next target for demonization?  He does express some very pesky opinions. Worse, he's appeared on @joerogan. Perhaps his bank accounts should be frozen."
jordanbpeterson,Right. People love Putin because he's white. One idea to explain the world. Who needs to think because racism. Good work @cenkuygur
jordanbpeterson,Not good. Not good. Not good. Not good.
jordanbpeterson,Ouch.
jordanbpeterson,But the planet.
jordanbpeterson,We probably can't. Too much red tape and moralizing. Endless hyper costly delays. If automobiles has been invented today they would clearly be deemed too environmentally unsafe and dangerous for use by the common citizen @pmarca
jordanbpeterson,Self righteous censors insist that satire is disinformation @nandoodles
jordanbpeterson,Authoritarian compassion strikes again.
jordanbpeterson,"Obviously. Thank God for frackers. And an additional benefit, for those who care: a marked reduction in CO2 admissions. And how about a joint Canada-US energy strategy? Talk with @jkenney and @PremierScottMoe @DanCrenshawTX"
jordanbpeterson,In no small part due to the brilliance and far sightedness of our present leadership @JustinTrudeau
