author,content
jordanbpeterson,Delivering such idiocy to children is much easier than teaching (plus the unearned moral kick)....
jordanbpeterson,Journalist Mark Gollom @CBC played it straight with the story but the woke narcissists of compassion working there couldn't resist....
jordanbpeterson,Do not let the socialist globalists redistribute your money by force...
jordanbpeterson,This is a very informative YouTube channel (history/economics/statistics) https://t.co/CEdE5DdQo6
jordanbpeterson,Do we believe this woman?  https://t.co/yfm8S54UpB
jordanbpeterson,Ralston College and the Rejuvenation of Higher Ed | City Journal https://t.co/7jiwQMrjE3
jordanbpeterson,"translation: ""we're returning some of the money we stole from Canadians by compelling them to act on the half-truths and lies we are propagating about a non-existent climate emergency"" @JustinTrudeau any time you need some help communicating in a straight manner let me know"
jordanbpeterson,TikTok trend advocates meat-eating habits of a lion - Beef Central https://t.co/EbVf0L4U4s
jordanbpeterson,Affaire Jordan Peterson: protégeons l'individualité | JDM https://t.co/pkD4KITyEs
jordanbpeterson,https://t.co/xT9SGdVVhZ
jordanbpeterson,There is no shortage of people in the Canadian judiciary  who now believe it is perfectly appropriate for ideologically-addled bureaucrats to issue diktats restricting free speech: leftists: what happens when the shoe is on the other foot? https://t.co/LZkGbE1aBl
jordanbpeterson,"Ralston College and the Rejuvenation of Higher Ed | City Journal https://t.co/jiUAnc2FNA I serve Ralston as Chancellor; an endeavour independent of the upcoming Peterson Academy, which will offer the highest-quality online ed. https://t.co/lM4s5h2kTt"
jordanbpeterson,It means painfully unqualified and utterly malleable...
jordanbpeterson,I think we both belong on the cover of Sports Illustrated... @GadSaad
jordanbpeterson,Assortative mating perhaps plays a role: rich successful women mostly only marry richer more successful men... https://t.co/sGfy5IZmUE
jordanbpeterson,It's time to resist all this nonsense.
jordanbpeterson,We can get that to 50% with Justin a bit more effort @JustinTrudeau
jordanbpeterson,Dr Todd Grande @grande_dr on @CPOntario and their decision to force me to re-educate myself and modify my social media communication https://t.co/T0e3GsNFka
jordanbpeterson,It's obviously time for the tourist agencies in Finland to market to incels... :)
jordanbpeterson,Which of these are true? Or perhaps neither because eight years is the wrong time frame. But what time frame is correct? https://t.co/4VUmyzg35l
jordanbpeterson,Some words of support and caution to the public re regulatory boards from a fellow psychotherapist: https://t.co/2fzjIKF5tW
jordanbpeterson,Canada's state subsidized broadcaster @CBC had the good grace to put a journalist with integrity on this issue and play it straight: https://t.co/XdpCBHuV3U
jordanbpeterson,Thanks Chanel
jordanbpeterson,"I'll take ""climate change"" over interventionist globalist bureaucrats any day."
jordanbpeterson,"As Solzhenitsyn said, one man who stops lying can bring down a tyranny @joerogan"
jordanbpeterson,"Absolutely. Aim up, young men, with all your souls' might."
jordanbpeterson,"Such a response from a physician is now legally required in Canada. Beware, parents of gender-dysphoric children (encouraged by their idiot, malevolent ""educators"")."
jordanbpeterson,I'm afraid it's pearls before swine @ABDanielleSmith. Do you suppose @JustinTrudeau will discuss this with @s_guilbeault before they reject your offer to provide an environmentally sound necessity at low cost to our Japanese allies?
jordanbpeterson,"Take note, Canadians. We now make 40% less than our American counterparts. But sensible policy is possible."
jordanbpeterson,"Right you are Senator Lee. All those ""extra mouths."" How annoying is that?"
jordanbpeterson,Any thoughts @CBC ?
jordanbpeterson,If she fails perhaps @JustinTrudeau's Canada can offer her assisted suicide
jordanbpeterson,Hello @TowersDr. Happy New Year: Any comments on my @CPOntario sentencing to social media communication retraining by the College of which you are a member?
jordanbpeterson,"There are lies, damned lies, statistics... and then the UN @UN"
jordanbpeterson,"Good, for obvious reasons. Bad because if public trust in in state ed has fallen such that these measures are necessary society is truly in trouble."
jordanbpeterson,Serpents slither...
jordanbpeterson,Double mastectomy at 15. At the hands of her compassionate gender-affirming physicians.
jordanbpeterson,"Dead people are less expensive. And, as a benefit, they produce very little C02!"
jordanbpeterson,"That's all performative, Rob. Cross-culturally. For thousands of years :)"
jordanbpeterson,Canada could gain 4.2 million square kilometres of agricultural land as a result of climate change https://t.co/XfT8CyZsoq
jordanbpeterson,"How about the top 1%? Are us ""white""
dudes managing to maintain our patriarchal oppression there, still?"
jordanbpeterson,Do trans women suffer systemic discrimination when they seek an abortion? Just wondering...
jordanbpeterson,"I suppose I'm a journalist of sorts. Here's a question for you: why do you support @JustinTrudeau for no discernible reason and, simultaneously, criticize him?"
jordanbpeterson,It really isn't obvious to me why that's better...
jordanbpeterson,The spelling alone implicates her.
jordanbpeterson,She sure thinks we deserve a lot.
jordanbpeterson,The land of the strong and free :(
jordanbpeterson,I think we'd have a little chat...
jordanbpeterson,"None of this has anything at all to do with ""trans rights."""
jordanbpeterson,"Some hypotheses:
Very youthful population?
Relatively poor medical records?
Extremely wide spread natural immunity protecting against later variants?
Comparative overstatement of death rates in the west?
More sunshine and Vitamin D?
Less obesity?"
jordanbpeterson,The goal is the elimination of private mobility because the planet.
jordanbpeterson,What do you think @JustinTrudeau? Mandatory or not?
jordanbpeterson,As long as my government doesn't compel me to use wolf-centric pronouns
jordanbpeterson,Meanwhile our socialist party leader so incompetent he couldn't even negotiate a cabinet seat as the price for his soul continues to support the very Liberals he  criticizes @theJagmeetSingh @JustinTrudeau
jordanbpeterson,"Canadians: the effectiveness of the the medical, legal and other professionals you depend upon are being fatally compromised by intrusive ideologues in the bureacracy and government https://t.co/XNSj6mnt96"
jordanbpeterson,"Oh, Canada..."
jordanbpeterson,Once they freeze to death they'll emit a lot less carbon...
jordanbpeterson,"In all fairness, it is a pretty good wolf suit..."
jordanbpeterson,"Radical inclusiveness is indistinguishable from pride: ""we can even incorporate the poison fruit of the snake""-- Eve and Adam forever and ever amen."
jordanbpeterson,Carnival...
jordanbpeterson,Because men hide their light under a bushel...
jordanbpeterson,Coal too @PeterDClack ?
jordanbpeterson,https://t.co/dDD83yKAwu
jordanbpeterson,"Who defines porn, and how? Do we keep Renaissance nudes? A serious question.."
jordanbpeterson,It's pretty sad that this is necessary given all the true health risks (obesity; diabetes; postmodern Marxism) but it appears nonetheless to be...
jordanbpeterson,It's pretty sad that this is necessary given all the true health risks (obesity; diabetes; postmodern Marxism) but it appears nonetheless to be...
jordanbpeterson,Thank you. Watch out for your College :)
jordanbpeterson,I think I'm cuter than Madonna...
jordanbpeterson,Inexcusable abdication of professional responsibility. Take note of those words @CPOntario
jordanbpeterson,"One of many such ""ideas"" (truly anti-ideas)"
jordanbpeterson,"The utopian globalists in action. Give up your car, your money, your children and the future while failing utterly to save a planet that is not in crisis. This has to stop."
jordanbpeterson,"Don't let this happen, Canadians. You'll never be able to trust your professionals again if the government controls their tongues."
jordanbpeterson,And the bookbinder engaging in this woke historical revisionism lives in what city and country?
jordanbpeterson,"There's a shock. The Collleges designed to ""regulate"" professionals in Canada have become woke commissars--like @CPOntario"
jordanbpeterson,Jordan Peterson holds a number of contentious positions. Threatening his license over his opinions is an affront to liberty. https://t.co/LillOqI40H via @reason
jordanbpeterson,Very funny or maybe not
jordanbpeterson,Diet and depression https://t.co/mmFQJJkq0I
jordanbpeterson,People seem to like this: advice for young people  https://t.co/tF9Yj49GU8 via @YouTube
jordanbpeterson,Thank you ma'am.
jordanbpeterson,The Toronto Sun ⁦@TheTorontoSun⁩ covered today's protest against ⁦@CPOntario⁩  https://t.co/1Fnog2q9MK
jordanbpeterson,Any coverage of this from Trudeau's paid minions at @CBC ?
jordanbpeterson,Query @CPOntario dies this protest constitute a public complaint about your professional conduct? Looks like a lot more than the dozen or so who have attempted with your help to vilify me...
jordanbpeterson,Looks like it's time to freeze some more bank accounts @JustinTrudeau
jordanbpeterson,See the great book The Great Mother by Erich Neumann. The negative elementary feminine is the archetypal devouring mother: death and torment by compassion.
jordanbpeterson,Did any of this hit mainstream news?
jordanbpeterson,Very interesting...
jordanbpeterson,Surplus. Let that sink in Canadians.
jordanbpeterson,A very useful thread...
jordanbpeterson,Science progresses every time a single scientist is right when every one of his peers is wrong.
jordanbpeterson,How'd it go?
jordanbpeterson,That's the new world order...
jordanbpeterson,Hire a chaperone to protect her from Grandma...
jordanbpeterson,Hi guys @CPOntario
jordanbpeterson,Diagnosis and cure...
jordanbpeterson,Wait until I interview him. Really. Coming sooner than you think.
jordanbpeterson,"Hello darkness, my old friend..."
jordanbpeterson,Maybe in a tight little yellow number? https://t.co/pcoBNWdNS1
jordanbpeterson,Not so much as it creates them :)
jordanbpeterson,But isn't it convenient that the interests of the biosphere and those who want such power always so mysteriously dovetail?
jordanbpeterson,"There is literally nothing the woke mob will allow to be excluded from centralized control... for the sake of ""the planet"""
jordanbpeterson,"No, that's Canadians. Still smitten with @JustinTrudeau"
jordanbpeterson,"Because the default or a priori feminine ethos is ""care for infants""?"
jordanbpeterson,"Told you so (or, as Ricky puts it: https://t.co/g5nSXCjODR)"
jordanbpeterson,Number 8. That damned Goggins is ahead again :) https://t.co/7IBVwqoJHh https://t.co/Uhh8m6rsa8
jordanbpeterson,From @WSJ https://t.co/tcir1zlhD3 https://t.co/3IjKO1Pav8
jordanbpeterson,I can imagine even worse Jordan Peterson's but I try to keep them in check :) https://t.co/f6PNRcyF3h https://t.co/EQn1U07rEF
jordanbpeterson,Gaston or the (redeemable) Beast? I stand for the latter... and so do the wise Beauties.  https://t.co/WGHSO2nM48
jordanbpeterson,If you're not too busy this afternoon in Toronto: https://t.co/swwlSxp90K
jordanbpeterson,Another reporter too wilfully blind and self righteous to stand up for what lets him practice his craft https://t.co/Yx6QxHwGrG via @NatObserver
jordanbpeterson,"And (surprise, surprise) it's Michelle Goldberg, who just failed entirely to defend the proposition that the legacy media was trustworthy in a debate with @DouglasKMurray @michelleinbklyn https://t.co/NDffgcPf3S"
jordanbpeterson,"The @nytimes just can't quit: ""this grandiose project."" One conservative College (opposed to, say, a thousand liberal colleges): https://t.co/4lpB66tG4t"
jordanbpeterson,"I think we should stop using the word ""outside."" Maybe I'll use in in a tweet (whoops, just did) and see if the commissars at @CPOntario will suspend my clinical license..."
jordanbpeterson,Just another reason to spend tens of thousands a year to send your kids to university...
jordanbpeterson,"This new digital graffiti is rad, man."
jordanbpeterson,Turns out we need electricity. Who'd have guessed it? https://t.co/qAXpvbw31C
jordanbpeterson,30000 have signed this in the last few days: https://t.co/atx8Bvkxez
jordanbpeterson,This is pretty nice.
jordanbpeterson,Keep your kids home Canadians.
jordanbpeterson,I'm shocked. Shocked I say.
jordanbpeterson,For the environmental zealots this is a feature not a bug https://t.co/DW2YeggaZH
jordanbpeterson,Dr W: stupid people need grants too.
jordanbpeterson,Imagine that.
jordanbpeterson,DIE rot apparently begins at the head https://t.co/9ZRr3ljNcJ https://t.co/J7cw5uYqv5
jordanbpeterson,Appalling doublespeak ideological claptrap.
jordanbpeterson,AFL 2023: Crows ruckman Reilly O’Brien responds to Jordan Peterson outrage https://t.co/xXE1qXC6go via @thetiser
jordanbpeterson,Thank you @BasedMikeLee
jordanbpeterson,Maybe we should push a virgin into a volcano...
jordanbpeterson,An interesting thread...
jordanbpeterson,Do you want the government to hold the threat of suspension of livelihood and public shame over those who disagree with them?
jordanbpeterson,"Why should anyone care? Do you want your professionals to be forced to lie to you? When you are in the midst of a serious medical, psychological or legal crisis? @CPOntario"
jordanbpeterson,I wrote to @JustinTrudeau and published that in the @nationalpost -- since part of the reason I have been sentenced was for criticizing Canada's Prime Minister and his cronies: https://t.co/uk1d2DZg93
jordanbpeterson,"Here is a previous thread outlining some relevant background, both practical and conceptual: https://t.co/WrN8iBt6of"
jordanbpeterson,There appears to be some interest from the public in sharing my mandatory re-education @CPOntario take note: https://t.co/FhAtpIq3Gk
jordanbpeterson,"Here is the summary and decision/sentence already handed down by the College of Psychologists of Ontario 
@CPOntario: https://t.co/QlqytIEyrF"
jordanbpeterson,"Here is a previous thread outlining some of the relevant background, conceptual and practical: https://t.co/PD48euMgAG"
jordanbpeterson,"I am making all this as public as possible to shed light on the machinations of professional colleges, which now routinely pressure their members to abide by the diktats of the politically correct."
jordanbpeterson,"Here is updated documentation relevant to my pending Ontario College of Psychologists' re-education (screenshots of the ""charges""; redundant pages removed: https://t.co/SXcOD0naTW
In this thread I will also post the entirety of their summary and decision. Take note @CPOntario"
jordanbpeterson,From Italy https://t.co/B2NfDp4LfA
jordanbpeterson,It's because I have their number:  https://t.co/x1ICAb2PPv
jordanbpeterson,https://t.co/SyjTE48xIH
jordanbpeterson,The term doesn't imply. It directly indicates.
jordanbpeterson,No moral hazard here folks. Move on....
jordanbpeterson,The Scandinavians are coming to their senses.
jordanbpeterson,"Michael Malice with @MikhailaFuller on Why You Should Leave New York, Bad Relationships, and ... https://t.co/PTyPC4kRuZ via @YouTube"
jordanbpeterson,Rupa Subramanya: Jordan Peterson is being punished for daring to contradict leftist orthodoxy https://t.co/xH03Te0IaS via @nationalpost
jordanbpeterson,https://t.co/CHuw7M1No1
jordanbpeterson,"Do these count as complaints, as did the tweets you counted? But this is just 4000X times as many...."
jordanbpeterson,Looks like about 50000 more people in approx three days would rather the Ontario College of Psychologist commissars resign (instead of approving of them disciplining me). How does this stack up against a dozen complaints @CPOntario?
jordanbpeterson,Where'd you go @charlesadler ? Don't want to play your brutal game anymore? https://t.co/N8vTWzVYDs
jordanbpeterson,Documentary preview: my Logos &amp; Literacy : a DWPlus production https://t.co/79VviIHfcQ via @YouTube
jordanbpeterson,Does this make any difference @CPOntario ? Would a few thousand more? Didn't think so... https://t.co/qr3CLTVBsx
jordanbpeterson,"To the commissars at the Ontario College of Psychologists--right, colleagues?  @CPOntario"
jordanbpeterson,This is true. Fatherlessness is an intergenerational catastrophe @JoelBrownMD
jordanbpeterson,"Os Guiness, a very wise man, interviewed by John Anderson, a very wise man: Forgiveness Overcomes Cancel Culture https://t.co/B855XbLO4x via @YouTube"
jordanbpeterson,And consider watching this: the wounds that don't heal: https://t.co/Y0XQSNQ5qL
jordanbpeterson,In what universe is this action by @PPFA not utterly monstrous? A cold can't be assessed remotely in 30 minutes. I'm saying it bluntly: this is as bad as the Tuskegee experiment. This is as bad as Auschwitz medical barbarism: https://t.co/aqK0HIwd1p https://t.co/o0PTZ73cMG
jordanbpeterson,"Deny them coal because ""the planet"" says the woke apocalypsts who simultaneously decry ""colonialism."""
jordanbpeterson,Obligan al psicólogo Jordan Peterson a completar un curso de «reeducación» por criticar a Trudeau https://t.co/Xk0Dau0WyG
jordanbpeterson,https://t.co/GuhCwxpAlx
jordanbpeterson,"What have I said that you regard as worthy of quasi-criminal persecution? And I'm telling you straight:you should be praying that the forces you are pleased to see arrayed against me are never brought to bear on you. Karma, Mr ""Ace"": hope you never have reason to rue your words."
jordanbpeterson,We'll see about that. And what exactly is the point you're making?
jordanbpeterson,"Only when the system is corrupt. And what exactly do you consider my crime, or are you just carping stupidly and carelessly from the safe sidelines?"
jordanbpeterson,And why do you think in your pathetic envious manner that this is the issue at hand?
jordanbpeterson,Poor us: all we did was publicly denigrate someone's reputation and threaten his livelihood and he oppressed us by revealing exactly what we were doing @CPOntario are you ready to resign yet or are you going to play out the whole drama? I'm fully and complete prepared either way
jordanbpeterson,The compassionate narcissists of modern woke left regard self-defence--which in this case is pure revelation of the unvarnished facts of the matter--as harassment. And that will be the tack most likely taken by the @CPOntario commissars:
jordanbpeterson,Which makes you an all-too-typical example of the modern derelict posing as a journalist
jordanbpeterson,I think your enterprise is the worst sort of scandal-mongering reputation-savaging narcissistic rag @JesseBrown @Canadaland and that you are more than willing to make your reputation with innuendo and denigration at the expense of others
jordanbpeterson,"I think there's a 50% chance that @CPOntario will prevail in imposing its sentence and suspending my licence, despite whatever degree of public support there might be for my case. Canada is a lot farther gone than it might appear..."
jordanbpeterson,"Wake up, citizens: professionals are now required to hold their tongue if they believe anything politically verboten. For all you leaning to the left--sometimes validly: these precedents will eventually be weaponized by those who stand opposed to you"
jordanbpeterson,https://t.co/xupTaWAC1r @PierrePoilievre
jordanbpeterson,String from a fellow psychotherapist....
jordanbpeterson,https://t.co/BVKUgj0U3C
jordanbpeterson,https://t.co/MT2N9y5bgP
jordanbpeterson,https://t.co/4s1yPVUklz
jordanbpeterson,And maybe we could read small children stories at the same time... @GadSaad
jordanbpeterson,His brother is apparently not one of those so fooled. But what would he know? https://t.co/jbP9DLHC9R
jordanbpeterson,Expect much more of this. For shame @metpoliceuk you have become veritable thought police.
jordanbpeterson,"Since it needs to be said: who you want to have sex with is not ""your identity"""
jordanbpeterson,"""Rainbow themed merchandise""'purchase by police as part of the LGBT (etc. etc. ad absurdum ad nauseum) lobby's happiness ""or else"" policy"
jordanbpeterson,"I'll post my talk with Judith Curry this week @curryja and I think we'll escape any attempts at censorship although @YouTube will inevitably add a pathetic and manipulative bit of Orwellian double-speak ""context"" information just to show they can..."
jordanbpeterson,There is truth in this
jordanbpeterson,Climate doomsters are once again hijacking science to push a toxic agenda https://t.co/YVwmJ17XCv
jordanbpeterson,This is quite beautiful...
jordanbpeterson,https://t.co/wpvUqwLC0k
jordanbpeterson,Let's talk about your book on my podcast @BillMorneau6 soon
jordanbpeterson,Right from the horse's mouth: @JustinTrudeau's former Finance Minister on our PM's self-centred narcissism and lack of interest in economic policy https://t.co/9OwpViI1w4 @BillMorneau6 https://t.co/cjP0BIeO1s
jordanbpeterson,https://t.co/ffV3F5fLep
jordanbpeterson,"You'd imagine that a ""reporter"" would have enough sense to stand stalwartly for free speech."
jordanbpeterson,https://t.co/yDwhapLNkE
jordanbpeterson,https://t.co/LN0OceYRB7
jordanbpeterson,https://t.co/SJ7gvxmAcQ
jordanbpeterson,https://t.co/lIpLB4OHKS
jordanbpeterson,"Not true, yet. But soon. But Canadians insist on sleeping in the daze produced by @JustinTrudeau's narcissistic compassion and undeniable celebrity charisma. You can fool some of the people, some of the time..."
jordanbpeterson,https://t.co/kJi3r0EXln
jordanbpeterson,https://t.co/uBR68w4pxX
jordanbpeterson,https://t.co/TZnY5n8UsQ
jordanbpeterson,https://t.co/BLtdvKwrIJ
jordanbpeterson,https://t.co/NKoRuCWmR4
jordanbpeterson,https://t.co/2LKtAEGUXQ
jordanbpeterson,Sorry to hear about your YouTube demonetization @BretWeinstein isn't it ironic that the word is so closely akin to demonization.... What's up @YouTube? How dare you? Has the FBI been knocking on your door? Or the Biden admin?
jordanbpeterson,Hey @joerogan and @BretWeinstein this is even more preposterous than you think: https://t.co/lsWLODCJKl
jordanbpeterson,It was good to see you Nicole. Happy New Year @NicoleArbour
jordanbpeterson,"For all you tweeting your admiration for @atRachelGilmore: she is not ""reporting"" any of this. She is merely copying and retweeting what I already voluntarily posted. There is no inquiry or journalism involved, regardless of the innuendo (""strap in"")."
jordanbpeterson,"And why do you care, exactly, since you already screenshotted and reposted almost all of it? A little more innuendo to spread, perhaps? https://t.co/ez3eSzK9as And you can tell how much I have to hide by the fact that I am reposting your thread..."
jordanbpeterson,It's just because I know that I'm too old to change :) @bariweiss
jordanbpeterson,"Don't get yourself in a self-righteous knot: it'll be back up soon, in identical form, but slightly different file format... 

You really don't learn, do you?"
jordanbpeterson,Maybe we could whip each other @GadSaad and charge the woke to watch...
jordanbpeterson,"If you go, please be good."
jordanbpeterson,Read the court filing by Jordan Peterson against the College of Psychologists of Ontario https://t.co/axwx1SYUnQ
jordanbpeterson,EDITORIAL: The Orwellian re-education of Jordan Peterson https://t.co/3U2dJguVoC
jordanbpeterson,Why indeed?
jordanbpeterson,The cancelled and still-banned-from-Twitter Professor Michael Rectenwald's new book: https://t.co/rrNZmaBVTT @elonmusk perhaps he's someone to look into re Twitter ban
jordanbpeterson,"It is definitely the case. One complainant, whose actions were supported by @CPOntario, claimed that my political tweets were in and of themselves evidence of mental illness. https://t.co/DLltyXAGRi https://t.co/1JEcx3c9KN"
jordanbpeterson,Only 4200% (!) https://t.co/VSNlq3MgEa via @collegefix
jordanbpeterson,From the article https://t.co/kzB1bddl0o
jordanbpeterson,Rex Murphy: Jordan Peterson's foes need their heads examined https://t.co/9lnrTGunfb via @nationalpost
jordanbpeterson,How funny is this @CBC obviously time to ramp up the corporate DIE virtue-signaling to an even more fevered pitch
jordanbpeterson,"Young people: this is information you need: from Fossil Future by Alex Epstein. You don't have to give up your opportunity, mobility, warmth and freedom to ""save the planet."" Don't let the eco-moralizers steal your future. https://t.co/ZoSXnWjnsq"
jordanbpeterson,Happy New Year sir @JonHaidt
jordanbpeterson,Rule 1 from 12 Rules of life...
jordanbpeterson,"This is because of increased ""climate variability."" Remember: you read it here first. This will be the next pivot term--global warming, superseded by climate change, replaced by climate variability. Same apocalypse, though :)"
jordanbpeterson,"Bari Weiss's Free Press, commenting on my sentencing at the hands of the @CPOntario commissariat https://t.co/zMkro1j8vH https://t.co/KjzYSD1On3"
jordanbpeterson,"Query for @CPOntario if I am the paying client for my mandatory re-education, can I film the interchange and post it on YouTube so everyone can learn? And the public says:"
jordanbpeterson,I have been sentenced by @CPOntario to mandatory communications retraining in part because I retweeted @PierrePoilievre. It's time for the commissars there to resign.
jordanbpeterson,Read the tweets that got Jordan Peterson investigated by College of Psychologists. https://t.co/UR5d5PxhYV
jordanbpeterson,Michael Higgins: Jordan Peterson resists his critics’ clumsy forced re-education. https://t.co/2LKtAEGUXQ
jordanbpeterson,Read the court filing by Jordan Peterson against the College of Psychologists of Ontario. https://t.co/axwx1SZsdo
