author,content
jordanbpeterson,The painfully obvious as stunning revelation.
jordanbpeterson,No. But point made @LKrauss1
jordanbpeterson,"""does not intend to publish"" = hide and lie"
jordanbpeterson,"Fatherless children are at much greater risk for drug and alcohol abuse.

Children in single-parent families are also twice as likely to commit suicide. https://t.co/nFW9DKLiJO"
jordanbpeterson,Met with @PageauJonathan and @vervaeke_john in Toronto last week for an intense three-hour exchange of views on narrative and nomological reality. Bet you all can't wait for the release of that :)
jordanbpeterson,"Releasing my Nov talk with Dr. Richard Dawkins @RichardDawkins on Thursday (audio and YouTube). Thank you, Dr Dawkins. I would have liked to speak much longer, even if you did give me a rough time about some previous comments I made re horizons of the psychedelic experience :)"
jordanbpeterson,"Releasing today @PierrePoilievre and an unscripted two-hour back-and-forth on @JustinTrudeau energy, the (damnable) @CBC No edits; no agreed-upon topics; nothing off limits. Setting a new standard for political dialog in the post-soundbite age."
jordanbpeterson,How about the 1.2 billion dollar yearly subsidy paid by the Canadian federal government to the state broadcaster @CBC @JustinTrudeau @joerogan and more money doled in a similar way to other legacy news media? Quasi-fascist colllusion (fasces: to bind together)
jordanbpeterson,A reminder https://t.co/4ZbBTQc2DX via @YouTube
jordanbpeterson,"TALINN: MEETINGS: I am in TALINN June 21-23 for my Beyond Order tour. Who should I meet with: journalists/news sources, businessmen, artists, podcasters, politicians? Use link (https://t.co/THLj886uZY) or QR code to respond. Thanks. . https://t.co/rSVHA6sgZn"
jordanbpeterson,TALINN: TO SEE OR DO: I am in TALINN June 21-23 for my Beyond Order tour. What should I see or do there? Use link (https://t.co/ZQto0F1xXA) or QR code to respond. Thanks. https://t.co/Mk6OluCEN6
jordanbpeterson,"WARSAW: MEETINGS: I am in WARSAW June 19-21 for my Beyond Order tour. Who should I meet with: journalists/news sources, businessmen, artists, podcasters, politicians? Use link (https://t.co/ERCDqWdiFl) or QR code to respond. Thanks. https://t.co/eV8OKXVGxf"
jordanbpeterson,WARSAW: TO SEE OR DO: I am in WARSAW June 19-21 for my Beyond Order tour. What should I see or do there? Use link (https://t.co/ePUUOx6nkd) or QR code to respond. Thanks. https://t.co/vcnIz1AJ26
jordanbpeterson,This what happens to naive people. The uncritically compassionate aid and abet the monsters. Pity without justice is no virtue.  https://t.co/EOdZhKLA1v
jordanbpeterson,The iron law of unintended consequences:  https://t.co/EOdZhKLA1v
jordanbpeterson,"How optimism can be created by admitting you have a problem. 

From my interview with @rustyrockets on Under the Skin. https://t.co/49kQyt79Y6"
jordanbpeterson,"BELGRADE: MEETINGS: I am in BELGRADE June 14-15 for my Beyond Order tour. Who should I meet with: journalists/news sources, businessmen, artists, podcasters, politicians? Use link (https://t.co/8L51HmWT5n) or QR code to respond. Thanks. https://t.co/7y0pzGihVl"
jordanbpeterson,BELGRADE: TO SEE OR DO: I am in BELGRADE June 14-15 for my Beyond Order tour. What should I see or do there? Use link (https://t.co/aygCoMdDBv) or QR code to respond. Thanks. https://t.co/PgC5tNxCDe
jordanbpeterson,"ZAGREB: MEETINGS: I am in ZAGREB June 14 for my Beyond Order tour. Who should I meet with: journalists/news sources, businessmen, artists, podcasters, politicians? Use link (https://t.co/EnwWEyTUkd) or QR code to respond. Thanks. https://t.co/w09YgfrejP"
jordanbpeterson,ZAGREB: TO SEE OR DO: I am in ZAGREB June 14 for my Beyond Order tour. What should I see or do there? Use link (https://t.co/fmAFOwSbAG) or QR code to respond. Thanks. https://t.co/spllcCW8vG
jordanbpeterson,"LLUBLJANA: MEETINGS:  I am in LLUBLJANA June 12-13 for my Beyond Order tour. Who should I meet with: journalists/news sources, businessmen, artists, podcasters, politicians? Use link (https://t.co/TlC3dHGmYd) to respond. Thanks. https://t.co/2BcKQX9SXJ"
jordanbpeterson,LJUBLJANA: TO SEE OR DO: I am in LJUBLJANA June 12-13 for my Beyond Order tour. What should I see or do there? Use link (https://t.co/DofSGkahq8) or QR code to respond. Thanks. https://t.co/5CDjv14LNP
jordanbpeterson,"An act of supremely malevolent narcissism: to sacrifice living people to draw attention to a ""manifesto"": https://t.co/my3g4A4nrg
Someone with such motivation has spent a very long time in creative union with deep and profound evil."
jordanbpeterson,"BUDAPEST: MEETINGS:  I am in BUDAPEST June 10-11 for my Beyond Order tour. Who should I meet with: journalists/news sources, businessmen, artists, podcasters, politicians? Use link (https://t.co/zLFNAEKJRI) or QR code &amp; enter BUDAPESTJBP02 to respond. Thanks."
jordanbpeterson,"Always look at the single person, one after the other, focus on them, and talk to them as you would an individual. Make sure they're following along.

Listen carefully. If your audience is dead silent, you know you're on the right track. (3/3)"
jordanbpeterson,"Use your personal experience because that's something you're already a master of. You can use other material but it must tie to the real world through your own experience, otherwise it's not real.

Speak directly to the audience, to the individual in the audience. (2/3)"
jordanbpeterson,"A guide to public speaking.

1. You must have incredible knowledge of the topic.
2. You must have a point to speak of.
3. You have multiple stories on hand to illustrate your point.
4. Organise your talk around said point.

Talk about what you know. (1/3)"
jordanbpeterson,BUDAPEST: TO SEE OR DO: I am in BUDAPEST June 10-11 for my Beyond Order tour. What should I see or do there? Use link (https://t.co/URmgELl8hE) or QR code and enter BUDAPESTJBP01 to respond. Thanks. https://t.co/7kR1A8TGe4
jordanbpeterson,"COPENHAGEN: MEETINGS:  I am in COPENHAGEN June 09 for my Beyond Order tour. Who should I meet with: journalists/news sources, businessmen, artists, podcasters, politicians? Use link (https://t.co/djwYJbqIPd) or QR code &amp; enter COPENHAGENJBP02 to respond. Thanks. https://t.co/pKC4O4FsO4"
jordanbpeterson,"GOTHENBURG: MEETINGS:  I am in GOTHENBURG June 07-08 for my Beyond Order tour. Who should I meet with: journalists/news sources, businessmen, artists, podcasters, politicians? Use link (https://t.co/G9acieu0k1) or QR code &amp; enter GOTHENBURGJBP02 to respond. Thanks. https://t.co/wAn6vt0yDP"
jordanbpeterson,GOTHENBURG: TO SEE OR DO: I am lecturing June 5 for my Beyond Order tour. What should I see or do there? Use link (https://t.co/4CQTbVmEPB) or QR code and enter GOTHENBURGJBP01 to respond. Thanks. https://t.co/PQcOSvzhBk
jordanbpeterson,Middle schoolers charged with Title IX violation for using ‘incorrect pronouns’ https://t.co/usFSMjSll3 via @collegefix
jordanbpeterson,"Such things could never happen said everyone woke five years ago. You're exaggerating, said the same folks. You don't understand the law, they said."
jordanbpeterson,Seems right. So to speak.
jordanbpeterson,"""one of the students in the rainbow club"""
jordanbpeterson,I am seeing more and more genuine implacable anger (and vicious humor) in the crowd opposing the woke moralists (the compassionate authoritarians). It's really obvious with @GadSaad @DouglasKMurray @JaniceFiamengo
jordanbpeterson,I'd like to see some blood @GadSaad. How else would I know you're serious. See you in Montreal.
jordanbpeterson,MIT Sloan School goes full SJW - Workplace joy requires woke CEOs https://t.co/rIBe0z0Q5S via @Babbling_Beaver
jordanbpeterson,"I trusted the capitalist world a lot more when it was simply greedy. If you're dealing with someone who wants to make money, they're instantly understandable (assuming honest orientation). But these new moralists? I have no idea what they're up to: https://t.co/aIkb5Ywzys"
jordanbpeterson,Should I spend more time in Llubjana or Zagreb? I don't know much about either city.
jordanbpeterson,"OSLO: MEETINGS:  I am in Oslo June 06 for my Beyond Order tour. Who I should meet with: journalists/news sources, businessmen, artists, podcasters, politicians? Use link (https://t.co/7Kd9LJtnM4) or QR code &amp; enter OSLOJBP02 to respond. Thanks. https://t.co/7uK9N6XLd6"
jordanbpeterson,Thanks.
jordanbpeterson,Thanks.
jordanbpeterson,"STOCKHOLM: MEETINGS:  I am lecturing June 5 on my Beyond Order tour &amp; will arrive June 4. Who I should meet with: journalists/news sources, businessmen, artists, podcasters, politicians? Use link (https://t.co/nmQaQQRT7m) or QR code &amp; enter STOCKHOLMJBP02 to respond. https://t.co/jIcFgtkaGF"
jordanbpeterson,"STOCKHOLM: TO SEE OR DO: I am lecturing June 5 for my Beyond Order tour, and will arrive June 4. What should I see or do? Use link (https://t.co/uRzlipHf8Z) or QR code and enter STOCKHOLMJBP01 to respond. Thanks. https://t.co/TWUHyRe4jz"
jordanbpeterson,Feminism Are ENTITLED and HATE Men | Jordan Peterson Reaction https://t.co/PZz1e8XmuK via @YouTube
jordanbpeterson,The Key Difference Between Heaven and Utopia | Jordan Peterson &amp; Jonatha... https://t.co/7vt1mHJ2vd via @YouTube
jordanbpeterson,3.5 million @p_m_robinson
jordanbpeterson,Time will tell just who's a fringe minority....
jordanbpeterson,Take care of yourself Mr. Musk @elonmusk
jordanbpeterson,My discussion with Dr Richard Dawkins will be out soon @RichardDawkins
jordanbpeterson,"I've learned that if such things are important maybe it's better to write about them and publish it, which you could do. Then you don't get sucked into petty battles but also don't capitulate @Ayaan"
jordanbpeterson,Russell Brand vs the globalists It Begins https://t.co/lw1HcvUYyy via @YouTube @rustyrockets
jordanbpeterson,It seems unlikely on the face of it that you could read it in any case.
jordanbpeterson,Female pattern antisocial behavior=reputation destruction and arbitrary social exclusion
jordanbpeterson,Congrats @GadSaad and thanks for all the loot.
jordanbpeterson,Is Netflix leading the way out of corporate wokism? Is DeSantis vs Disney the cause?
jordanbpeterson,"With any luck the Yankees will put paid to this. Mess with the children of Americans at your peril, cowardly idiot politicians."
jordanbpeterson,"""tribunal"""
jordanbpeterson,Netflix continues to strengthen its spine.... @netflix
jordanbpeterson,"Dismal. Utterly provocative and narcissistic, as well as aesthetically tasteless in the extreme."
jordanbpeterson,https://t.co/BD7eI2mqZA
jordanbpeterson,"Actually, a lot of them have cleaned their rooms :)  See Rule 6: from 12 Rules for Life: Set your house in perfect order before you criticize the world https://t.co/kU4vw0n7m4"
jordanbpeterson,Netflix tells staff to LEAVE if they're offended by its content https://t.co/Wy9kscwspq via @MailOnline
jordanbpeterson,And Brock University pretends they treated this distinguished scientist well...https://t.co/tXMJzjQsBX
jordanbpeterson,"Assume that your truth, as lived and spoken, will produce the best possible outcome.

It’s an act of faith. But so is every other way of being. (4/4)"
jordanbpeterson,"Stop trying to use your speech to get what you want. You don’t necessarily know what you want. Instead, try to articulate what you believe to be true as carefully as possible. Then, accept the outcome. (3/4)"
jordanbpeterson,"If it makes you feel weaker, stop saying it. Try to reformulate your speech until you can feel the ground under your feet solidifying. Then practice only saying things that make you strong. (2/4)"
jordanbpeterson,"How to tell if you are speaking authentically.

Listen to yourself talk as if a stranger was talking. Try not to identify too much with what you are saying. Then, observe.

See if what you are saying makes you feel stronger, physically, or weaker. (1/4)"
jordanbpeterson,How old are you @ItsDeanBlundell? A clinical estimate: 8 years old and not very socially skillled.
jordanbpeterson,Re the hapless ⁦@theJagmeetSingh⁩ and his fealty to ⁦@JustinTrudeau⁩  https://t.co/f4JL2jSDDM
jordanbpeterson,EDI in STEM: Is it Time for an Open Discussion? - Patanjali Kambhampati https://t.co/77bTf90QhR via @YouTube
jordanbpeterson,"Free speech is essential to free societies.

From ‘The Importance of Being Ethical’. https://t.co/xA25GcNvWr"
jordanbpeterson,"There is little more terrifying than the possibility that you could come to a crisis point in your life when you need every faculty you possess to make the decision properly, only to find you have pathologized yourself with deceit and can no longer rely on your own judgment. https://t.co/uq9REHNZCr"
jordanbpeterson,"In the west, the Bible is the precondition for truth. 

From 'You Probably Should Have Read The Bible'. https://t.co/cfaBOYr1ZD"
jordanbpeterson,"We learned that behaving properly now, in the present—regulating our impulses, considering the plight of others—could bring rewards in the future, in a time and place that did not yet exist. https://t.co/UoWC8zAVlj"
jordanbpeterson,"If they don't kill everyone first...

The idiocy of intersectionality from ‘Identity Politics and The Marxist Lie of White Privilege’. https://t.co/LSMa88MhYC"
jordanbpeterson,New highly requested framed Beyond Order posters - https://t.co/KjQ4vlppTZ https://t.co/bIZ0mMWAQj
jordanbpeterson,"Douglas brings out the big guns. Don't wake the conservatives up, I said. Whoops. Too late @DouglasKMurray"
jordanbpeterson,The Scaffold - Lily The Pink https://t.co/Nzwy7GJVrk via @YouTube
jordanbpeterson,Receive ideas and excerpts like this in your inbox each week - https://t.co/HLIgYCtlQj
jordanbpeterson,"You make sacrifices in the present so that the future is better.

Everyone does that. You can bargain with reality. You can forestall gratification now, and it will pay off at a time and place in the future that doesn't even exist yet. (2/2)"
jordanbpeterson,"Sacrifice. What does that mean?

It's the discovery of the future. The future is actually a place where there is threat. It's always going to be there, so what do you do? (1/2)"
jordanbpeterson,Two million plus views in two weeks for the talk/interview I gave at Stanford (host @p_m_robinson @HooverInst on the psychological and social utility of ethical behavior https://t.co/CiAvZofjgP
jordanbpeterson,Shapiro and laser precision https://t.co/iorZkgNSYz @benshapiro
jordanbpeterson,At a Crossroads | Jordan B. Peterson | 2022 Hillsdale Commencement Address https://t.co/ABbIUvc2Ui via @YouTube
jordanbpeterson,Madness.
jordanbpeterson,Yes. Immediately.
jordanbpeterson,A Homer Simpson moment.
jordanbpeterson,It's about time @GovRonDeSantis good work.
jordanbpeterson,"YouTube: why in the world can't you control the comment spammers? It's your responsibility as a public domain player. Maybe some effort on verifying those who post, or limiting new accounts to a certain number of posts per month? It's cluttering up the platform @YouTube"
jordanbpeterson,Authoritarian compassion...
jordanbpeterson,"""Support somewhat greater"" regulation of the internet. What the hell does that mean? This is why we don't have direct democracy. It merely means something like ""we'd sort of like a better internet"" not ""we support Trudeau censorship."" The latter no one would agree to."
jordanbpeterson,That's because we're stupid. Or the poll is crooked. A little of column A and a little of column B.
jordanbpeterson,Beyond Order out in paperback in the UK! Thanks to Laura Stickney and everyone at @PenguinUKBooks https://t.co/HGXgqYQ0AS https://t.co/NgadzQZYM1
jordanbpeterson,Good to see you at the Derby @stephenblackwd
jordanbpeterson,And the sooner the better.
jordanbpeterson,Fix your own country @JustinTrudeau Canadian fossil fuel could have reduced European dependency on Russia. And you still don't get it. But your hair is perfect.
jordanbpeterson,"Mr. Pierre Poilievre spent two hours in a wide-ranging conversation with me today. No one can hide in long form dialog, and he didn't. Enough legacy media sound-bite governing. It's high time for some straight and detailed talk. Release slated for Monday. @PierrePoilievre"
jordanbpeterson,Good.
jordanbpeterson,That's much easier than solving a real problem.
jordanbpeterson,Be careful Mr Musk @elonmusk
jordanbpeterson,"But that wasn't real communism, or so claim all the would-be dictators. Good to see this given the seriousness that it has for so long been denied."
jordanbpeterson,Not good. https://t.co/7QiwWj3pua
jordanbpeterson,"On Canada's next PM, God willing... https://t.co/8exlLXr01b"
jordanbpeterson,"The farcical ""investigation"" into the Emergencies Act.  https://t.co/yItKW64wST"
jordanbpeterson,"Controlling Society Through Social Norms⁣
⁣
With Dr. Richard Wrangham https://t.co/fyh09LxHqX"
jordanbpeterson,Some of us bloody well understood. Because that's what the facts revealed. Overwhelming contributions of comorbities of obesity and age to death risk.
jordanbpeterson,"At the Kentucky Derby with Tammy and the Blackwoods (see @RalstonCollege) last weekend. You Americans: so theatrical, in the greatest of senses. https://t.co/CCw67i53lc"
jordanbpeterson,Book excerpt: The Canada I fell in love with is gone https://t.co/Vvim1uzOcl via @nationalpost
jordanbpeterson,Guess who and where? I watched and learned. https://t.co/K2x3kpta0E
jordanbpeterson,"Thank you for the invitation to speak at Hillsdale College's convocation, for the honorary degree and for the convictions you all seem to have maintained in the spirit of music and the humanities @Hillsdale https://t.co/mN6WJxCg0t"
jordanbpeterson,You have an ethical responsibility to surround yourself with people who have the courage and faith and wisdom to wish you well when you've done something good. And to stop you when you're doing something destructive. https://t.co/1CEQB5DTy1
jordanbpeterson,"What are you willing to sacrifice in order to move forward?

From Under the Skin with @rustyrockets. https://t.co/cwhHo4TTKO"
jordanbpeterson,"If you work as hard as you can on one thing, you will change.

You will start to also become one thing, instead of the clamoring multitude you once were.

It is far better to become something than to remain anything but become nothing. https://t.co/POCQfDxnoN"
jordanbpeterson,"What good is philosophy?

From the Brisbane show as part of the 12 Rules For Life tour. https://t.co/lx8PAIMo0D"
jordanbpeterson,"And then they also start to act all that out in the world, and that makes it worse. (4/4)"
jordanbpeterson,"People can't handle having the rug pulled out underneath them by people they love and trust. That does them in, you know? It makes them ill. It hurts them. Psychophysiologically, it damages them.

But more than that, it makes them cynical, bitter and vicious, and resentful. (3/4)"
jordanbpeterson,"You get walloped by life. There's absolutely no doubt about that. But I thought for a long time that people can hang handle earthquakes and cancer, and even death.

But they can't handle betrayal, and they can't handle deception. (2/4)"
jordanbpeterson,"We can't handle deceit or betrayal.

The people I've seen who've been really hurt have been hurt most by deceit. That's worth thinking about. (1/4)"
jordanbpeterson,"I have accepted an appointment as the Chancellor of @ralstoncollege. With the efforts of the very able president Dr Stephen Blackwood @StephenBlackwd we hope to fashion a truly classic liberal arts institution: 
https://t.co/JEq1ihhXTF"
jordanbpeterson,"Are we ignorant of our 'privilege'? 
 
From The Diary Of A CEO podcast with @SteveBartlettSC. https://t.co/lZHjxROFJy"
jordanbpeterson,You won't have the clarity of mind necessary to make the proper judgment because you have filled your imagination and perception with rubbish. (4/4)
jordanbpeterson,"So, if you've stuffed yourself full of lies, you're going to be in a crisis one day, and you're going to have to make a decision, and you're going to decide wrong, and you're going to be in real trouble. (3/4)"
jordanbpeterson,"Well, there are many reasons, but one of them is that you can't trust yourself if you lie.

And there are going to be times in your life when you have no one to turn to except you. (2/4)"
jordanbpeterson,"The danger of lying too much.

Lying is very powerful because you can manipulate the world with your language. And you can get what you want lots of times; or escape from things you don't want.

So, why not lie all the time? (1/4)"
jordanbpeterson,The Post Millennial acquired by Human Events Media Group to form 'new media powerhouse' - https://t.co/SHePMeQUDz
jordanbpeterson,"- Brian Peckford

The sad state of democracy in Canada under Trudeau. https://t.co/2QxDSuspto"
jordanbpeterson,Great talk. EDI in STEM: Is it Time for an Open Discussion? - Patanjali Kambhampati - https://t.co/4oIh9Et6Fk
jordanbpeterson,"I would not dare say I believe in God.

From 'Who Dares Say He Believes In God' https://t.co/MShbUsTlL2"
jordanbpeterson,Bill Maher Stuns Audience Defending Christian Site While Attacking Twitter - https://t.co/W82CUPqfq6 via @YouTube
jordanbpeterson,“Any professor who challenges the sacred cows of woke-ism will be ostracized and then eventually targeted for dismissal.” -  Prof. Widdowson https://t.co/yAYK5OuPIl
jordanbpeterson,ABSOLUTE Wisdom &amp; Inspiration With Jordan B Peterson https://t.co/2g2cWYRxwQ via @YouTube
jordanbpeterson,Thanks to Fonthill Mill for this custom Mappa Burl dining table. They deserve some business - https://t.co/2xS75EwPqY https://t.co/Gc18BC9QF8
jordanbpeterson,"Men have to toughen up.

Men demand it, and women want it, even though they may not approve of the harsh and contemptuous attitude that is part and parcel of the socially demanding process that fosters and then enforces that toughness. https://t.co/DIG7Fp1el1"
jordanbpeterson,"Would I ever run for Prime Minister?

From my conversation with @patrickbetdavid on @ValuetainmentTV. https://t.co/nUDvkCYGm0"
jordanbpeterson,"How to get power in the 21st century.

From my discussion with @DouglasKMurray. https://t.co/UB4f31zwGI"
jordanbpeterson,"And even if you do betray me, in a not-too unforgivable manner, I will continue to extend my hand. And part of the way I will do that is by telling you what I am feeling. (4/4)"
jordanbpeterson,"I will trust you—I will extend my hand to you—despite the risk of betrayal, because it is possible, through trust, to bring out the best in you, and perhaps in me. So, I will accept substantial risk to open the door to cooperation and negotiation. (3/4)"
jordanbpeterson,"That knowledge brings with it an arguably justified pessimism about human nature, personal and otherwise, but it also opens the door to another kind of faith in humanity: one based on courage, rather than naïveté. (2/4)"
jordanbpeterson,"A naive person trusts because he or she believes that people are essentially or even universally trustworthy. But any person who has truly lived has been—or has—betrayed.

Someone with experience knows that people are capable of deception and willing to deceive. (1/4)"
jordanbpeterson,"They do this primarily by rejecting them—but they also do it by shaming them, if men do not take responsibility.

Since women bear the primary burden of reproduction, it's no wonder. It is very hard to see how it could be otherwise. https://t.co/lBkkXFOpUA"
jordanbpeterson,Another cancelled professor fighting bravely for her rights: Frances Widdowson of Calgary Alberta's Mount Royal College - https://t.co/vFp4HSGRfy
jordanbpeterson,"Freedom of speech leads to the truth.

From the latest podcast episode with @DouglasKMurray. https://t.co/nyAAeWFHjj"
jordanbpeterson,Old photos posted on @parler_app - https://t.co/GdTSBLipaw
jordanbpeterson,"The Importance of Being Ethical, with Jordan Peterson https://t.co/CiAvZofjgP via @YouTube"
jordanbpeterson,The War On The West by @DouglasKMurray is now available for public purchase. I highly recommend it. https://t.co/GMBKQOdvhY
jordanbpeterson,"We're fragile creatures. And that means that life is hard and painful, and anxiety-provoking.

You need something to set against that—that's worthwhile—and that's your positive destiny in the world. https://t.co/IRREhtYp8c"
jordanbpeterson,"Identity politics is a reversion to tribalism. 

From REXTV (Rex Murphy) interviews Jordan Peterson. https://t.co/zp1k4O2Pqt"
jordanbpeterson,"The right to speak is critically important to allow our civilization not only to thrive but to survive. In part 2 of this compilation, we examine the power of free speech and potential responses to censorship. 

https://t.co/7AllrxbFEV https://t.co/km0wtd4bVG"
jordanbpeterson,"“For all my flaws, which are manifold, at least I am doing this. At least I am taking care of myself. At least I am of use to my family, and to the other people around me. At least I am moving, stumbling upward, under the load I have determined to carry.” (4/4)"
jordanbpeterson,"Then, when you wake up in the middle of the night and the doubts crowd in, you have some defense: (3/4)"
jordanbpeterson,"What is the antidote to the suffering and malevolence of life? The highest possible goal.

What is the prerequisite to pursuit of the highest possible goal? Willingness to adopt the maximum degree of responsibility. (1/4)"
jordanbpeterson,"Treasures of art and intellect should be an inheritance for everyone. That’s exactly what @RalstonCollege seeks to encourage. Learn how to apply for the MA in the Humanities. 
https://t.co/u5ScQsZDKC"
jordanbpeterson,"The more people sort themselves out, the more responsibility they will take for the world around them and the more problems they will solve.

If we put ourselves in order, perhaps we will do the same for the world. https://t.co/IycOmFhZr7"
jordanbpeterson,"A plan is better than no plan.

From the Brisbane show as part of the 12 Rules For Life tour. https://t.co/Wf0LZ4Lb7k"
