author,content
jordanbpeterson,There's a rumour that a close ally of the US just to the north has vast and reliable supplies of fossil fuel: contact @ABDanielleSmith for more information
jordanbpeterson,"There's no shortage of cancelled academics, and such mobbing is viciously harmful--both psychologically and socially. As the sadists who practice it both know and delight in."
jordanbpeterson,How could a narrow corporate monopoly like that possibly be misused? @rustyrockets this is your domain...
jordanbpeterson,Unless they're Canadian truckers.
jordanbpeterson,We can easily get that to 100% @PierrePoilievre
jordanbpeterson,It wasn't the Russians. It was MAGA Republicans who wanted to destabilize Canadian democracy. Because that's clearly top of their list of priorities!
jordanbpeterson,"Tell us what you really think, Mr. DeSantis @GovRonDeSantis"
jordanbpeterson,https://t.co/rDBVjsOgSO
jordanbpeterson,"We can do worse yet, Canada, and @JustinTrudeau has plans to make that inevitable."
jordanbpeterson,A terrible thread. The state of healthcare in Quebec....
jordanbpeterson,https://t.co/kUyEhKjkpE https://t.co/VedwjuFW7J
jordanbpeterson,South Pole Hits Record Cold November Temperatures – The Daily Sceptic https://t.co/RENqaEyAI9
jordanbpeterson,Why did my daughter become trans? - UnHerd https://t.co/NT0FHMSIGX
jordanbpeterson,"Winter's coming, and the greens are responsible for everything that's about to happen. Plain and simple."
jordanbpeterson,"""Just turn down your thermostat a few degrees. What harm could it possibly do"" = Die, Grandma! But there are too many people on the planet anyway, right, woke moralists?"
jordanbpeterson,Who thinks this is a good idea? https://t.co/W6AOj5I86o
jordanbpeterson,How about we don't copy the damnable CCP again: The birth of the biostate - UnHerd https://t.co/A7pnAzdsGN
jordanbpeterson,Nothing at all medical/fascist/totalitarian and creepy about the government agent uniforms on display here.
jordanbpeterson,There's a question. Apple captured by China. Not a good look @tim_cook
jordanbpeterson,God preserve us from David Suzuki and Margaret Atwood. Everything dreadful about elitist Canadians compacted into two individuals.
jordanbpeterson,"""energy-saving plans"""
jordanbpeterson,Sweden Wins! Country That Refused Lockdown and Kept Schools Open Has Lowest Pandemic Mortality in the World – The Daily Sceptic https://t.co/LFWMcVyUfM
jordanbpeterson,This is going to be a very long winter for the deluded Net Zero aficionados (and worse for those most seriously affected by their destructive and punitive policies).
jordanbpeterson,What's up @tim_cook ? This whole free speech thing getting you down? @elonmusk
jordanbpeterson,"No fascist government/media collusion. Stand or fall on your own, legacy media outlets!"
jordanbpeterson,Some rare forthrightness from the legacy media...@globeandmail
jordanbpeterson,This is an excellent article: The Real Story Behind Drag Queen Story Hour | City Journal https://t.co/neLYrmbwqf
jordanbpeterson,Obviously.
jordanbpeterson,"""artists and other creatives"" measured how?"
jordanbpeterson,The wind is always blowing in the demented imagination of the woke moralists.
jordanbpeterson,"""minds must be protected""'Heaven preserve us from such protectors @khamenei_ir"
jordanbpeterson,"And what will your idiot attempts to destroy the energy sector and not save the planet while the Chinese burn coal cost us, @JonathanWNV? and you haven't hit a single ""climate target"" yet, by the way @JustinTrudeau"
jordanbpeterson,You're an evil rat.
jordanbpeterson,"Ask the anti-semites, darling... and watch the malicious innuendo, while you're at it. Standard cowardly anonymous troll demon behaviour."
jordanbpeterson,The eternally successful minority eternally raises the hackles of the envious and malevolent.
jordanbpeterson,But the boys at the Babbling Beaver are here to help  https://t.co/YxzJmCKsEk https://t.co/IKzG2uQQgn
jordanbpeterson,https://t.co/XPqBXAvzy9
jordanbpeterson,For shame: the once great MIT forces its  faculty to kowtows cravenly to the DIE insect overlords https://t.co/FBVcAeskWI
jordanbpeterson,She's such fun @cafreeland
jordanbpeterson,Jews are canaries in the social coal mine. When anti-semitism becomes a moral necessity (even in its subtler forms) hell is about to make its appearance yet again.
jordanbpeterson,Doesn't your jaw ache from the continual effort of talking out of both sides of your mouth? @theJagmeetSingh
jordanbpeterson,https://t.co/Hnu2rIiaYF
jordanbpeterson,Expect much more of this... https://t.co/yHKbL0QG15
jordanbpeterson,Thousands of convicted pedophiles in California are getting less than a year of prison time | Daily Mail Online https://t.co/SXWpv8kPNV
jordanbpeterson,From @Timcast Fresh Take on Book of Exodus https://t.co/F2HOLK4CFK
jordanbpeterson,"Is that all, @VP ? Shilling shamefully for the pharmaceutical companies. The Biden admin is a subsidiary of Pfizer and Moderna. Appalling fascist collusion."
jordanbpeterson,"""report hate crimes"" screech the rainbow fascists https://t.co/svpiC1hEVN"
jordanbpeterson,She's a reliable journalist @rupasubramanya @elonmusk
jordanbpeterson,"""low fat"": why is this necessary? It's sugar that's the culprit, not fat. Thanks for the info @robkhenderson ""Full of nutritious goodness"": it is to laugh https://t.co/gNmMj1L2ji and by the way: f**k you, bug pushers."
jordanbpeterson,"Ice-free Arctic by 2020: remember that? One of many such ""expert"" predictions: https://t.co/HKi15f5zMC"
jordanbpeterson,"The ""media"" were captured long ago by what could be usefully considered the principality of the woke @elonmusk @PageauJonathan"
jordanbpeterson,The Chinese you admire are fabricating some nice quarantine camps. Maybe you could try that next time @JustinTrudeau
jordanbpeterson,"""lower carbon footprint"" but check out the greening that has resulted from increased C02: https://t.co/a1Rn76Inzx"
jordanbpeterson,Not the Washington Post? Who could have possibly predicted that? The environmental fascists will use their imaginary apocalypse to extend control over everything @robkhenderson
jordanbpeterson,As the cancel-culture reputation-savager psychopaths well know. I now know dozens of cancellees. The experience is roughly equivalent to a near-fatal illness...
jordanbpeterson,No wonder they don't like you @elonmusk
jordanbpeterson,Impoverishing the poor. Destroying the economy. Failing utterly to save the planet. Welcome to NetZero: which is what you'll be left with. Clue in @RishiSunak: you're looking a lot like @JustinTrudeau
jordanbpeterson,There are millions of us waiting for an answer @tim_cook
jordanbpeterson,This is such good news....
jordanbpeterson,"Why? We're no longer in a world where ""why?"" is relevant @elonmusk"
jordanbpeterson,"""suspicious fuel purchases"": expect a lot more of this."
jordanbpeterson,Expect a lot more of this as the companies that should serve us continue their transformation into narcissistic woke moralizers.
jordanbpeterson,Involuntary de-industrialization: coming soon
jordanbpeterson,"I imagine that the inquiry will be resolved in Trudeau's favor, shamefully, and that Canadians will get on with burying their heads in the sand."
jordanbpeterson,"""something I was completely unaware of"""
jordanbpeterson,I talked with my son and daughter about our new writing app Essay: for all this who want to think more deeply and clearly https://t.co/s6XGLOcsjh via @YouTube https://t.co/NlXE4iGvQI
jordanbpeterson,Behind the scenes at Essay - Write Better. Think Better. https://t.co/RWc1AthAPL via @YouTube
jordanbpeterson,Hilarious Dads - Funny Daddy and Babies Moments https://t.co/7YmUpc0eWY via @YouTube
jordanbpeterson,Helen Joyce was recently a guest on my podcast. She is as clearheaded an individual as you could hope to meet https://t.co/GWYMmNowla https://t.co/tvqTxPqTHR
jordanbpeterson,With the connivance of the Master of Gonville and Caius. Who says Delores Umbridge is a fictional character? https://t.co/6IDiqG3L1I https://t.co/9qZC3q1vL5
jordanbpeterson,"The same nest of vipers who did what they could to cancel me, by the way..."
jordanbpeterson,Helen Joyce (author of Trans) at Cambridge. The cancel culture fascists did everything they could behind the scenes to sabotage the talk... https://t.co/CzFOcbvBay via @YouTube
jordanbpeterson,Amazing.
jordanbpeterson,If you'd concentrate on this and bring the leftists to heel you could leave a true record of accomplishment. But Dems can't draw lines and the woke mob still rules....@POTUS
jordanbpeterson,"A truly fascist vision: ""everything will be integrated... governments, media and the general corporate world employing big data"": the ultimate vision of a top-down centralizer. Reject this ""tsunami"" of ""progress."""
jordanbpeterson,That'll save the planet...
jordanbpeterson,I preferred my multinationals simply greedy. Now they're greedy and oh-so-better than their customers. It's sickening @rustyrockets take note
jordanbpeterson,All tyranny is petty. It's in the nature of tyrants to be petty. The enforcement of petty rules defines tyranny.
jordanbpeterson,"I think it's pretty much time to reject all this: removal of paper towels from public washrooms, ""save the environment"" towel reuse messages in hotels, C02 footprint indications by airlines. Up yours, corporate overlords. Go away and leave us alone."
jordanbpeterson,"Precisely. Hypocritical to the ultimate degree ""we'll keep the land but please like us because we're so nice"""
jordanbpeterson,As much as I am no fan of @JustinTrudeau it is worth pointing out that he didn't actually say this....
jordanbpeterson,Marxists everywhere and the cowards rollover and enable them. This has to stop https://t.co/ZT5g27vsFr
jordanbpeterson,You are a stunningly malevolent troublemaker @nandoodles alone with the reprehensible Chad Loder (take note Andy @MrAndyNgo)
jordanbpeterson,Caving into the woke mob that brought one of you this? https://t.co/BdtVjVzZQq https://t.co/Wz9Zj3qaRv
jordanbpeterson,I could really do without the land acknowledgment propaganda delivered to me by a corporate behemoth @Qantas. I'm sure I'm not the only one who feels that way. Stick to (1) flying and (2) making money. I don't want or need moral lessons from you or any other corporation.
jordanbpeterson,But wasn't it fun trying? https://t.co/p77YVXhUjx via @YouTube https://t.co/rw5xILhK4r
jordanbpeterson,Normal? In the West? Now? We're a long way from normal @songpinganq
jordanbpeterson,"""read the introduction for free now!"""
jordanbpeterson,When do we get to try it?
jordanbpeterson,"""Inclusive excellence"": doublethink: https://t.co/zChhlTnZA1 https://t.co/wX4bWDCUcx"
jordanbpeterson,"""lead"": is it possible that she believes this? @melaniejoly"
jordanbpeterson,Bye bye automotive freedom. 'Twas nice to have known ye. https://t.co/tZUf9IwSVm
jordanbpeterson,https://t.co/BIKbWh6TrO
jordanbpeterson,Are they balancing gender while doing so? I certainly hope so :) (or affirming gender or ensuring gender equity or whatever the hell is politically correct right now)
jordanbpeterson,Oops! We ruined your life. Sorry :) https://t.co/l2AwqOg0TU
jordanbpeterson,Who leaps forward to define hate speech? Precisely those you would least want entrusted with the task...
jordanbpeterson,This is at least mildly amusing...
jordanbpeterson,"From the article: read the second paragraph, and ask yourself ""just what the hell are we doing?"" With @JustinTrudeau and @s_guilbeault leading the way... https://t.co/e4BSGgWnnN"
jordanbpeterson,Because they're formulated by narcissistic virtue-signaling panderers? Aided and abetted by captured legacy media sources? @globeandmail
jordanbpeterson,I think he should have showed up in womanface @TPostMillennial
jordanbpeterson,Thank the stars above for the free market https://t.co/VGRtBCs3cU
jordanbpeterson,"Death romanticism is very attractive to depressed adolescents, and very dangerous for that very reason @MrWinMarshall"
jordanbpeterson,"If you thought DIE was deadly, wait until you get a load of what the ESG-mongers have in store for you: a warning."
jordanbpeterson,Look closely. The effects of C02 on the planet.... https://t.co/Lc1iWcn9aM
jordanbpeterson,"Attention, artists! Don't you yet understand that such initiatives mean absolute death to the creative integrity that makes art itself possible?"
jordanbpeterson,She seems fun. Check out the thread...
jordanbpeterson,Try lowering energy costs. Help the poor! @POTUS
jordanbpeterson,Feminism: The Worst Thing To Ever Happen To Women? | Louise Perry | The T... https://t.co/LgLffe9cfz via @YouTube
jordanbpeterson,I doubt it's done yet @Roman_Baber
jordanbpeterson,:)
jordanbpeterson,My prediction? It depends on how far the pharmaceutical companies' share prices drop...
jordanbpeterson,Look inward @globeandmail: you're definitely part of the problem.
jordanbpeterson,"Will there be a committee of ""you're not black enough?"""
jordanbpeterson,The woke moralists are coming for your car: stop this before it spreads.
jordanbpeterson,"""some people will not be able to afford what they once had"" translation: poor people will have to starve and shiver in the dark. Really. Truly."
jordanbpeterson,"It's no worse than artists clamouring about, say, cultural appropriation or arbitrary diversity @ggreenwald"
jordanbpeterson,How black do the applicants have to be? Who tests them? Is it DNA or will casual visual observation suffice? Welcome to the new improved Canada: brought to you by your state-funded universities.
jordanbpeterson,How has that not been obvious for decades?
jordanbpeterson,If this de facto ban on cars succeeds in Cambridge it will definitely spread. Good luck @KeillerDon
jordanbpeterson,Pedophilia: the last frontier
jordanbpeterson,Stunning. Every day brings something inconceivable even a few years ago. A retailer romanticizes euthanasia.... how could that go wrong?
jordanbpeterson,That's great news.
jordanbpeterson,A tiny pathological minority enabled by virtualization and official cowardice.
jordanbpeterson,Perfectly in keeping with everything else our devious juvenile narcissistic PM @JustinTrudeau schemes up.
jordanbpeterson,But he needed Venezuelan oil after he killed Keystone. Give the poor guy a break...
jordanbpeterson,Who knows more about children's bodies than drag queens?  ;)
jordanbpeterson,Absolutely 100% hell no. Enough woke moralizing. Enough.
jordanbpeterson,Remember these? The APA is comprehensively corrupt: https://t.co/xWMsRJrVcC
jordanbpeterson,This is much better than the dreadful and corrupt APA guidelines for psychotherapy for men https://t.co/Us8krZEVGH
jordanbpeterson,A genuine good faith discussion re the complexities of genuine environmental stewardship https://t.co/nGA5vlzkEO
jordanbpeterson,"The Exodus Seminar Premieres On DailyWire+
 https://t.co/jZzSlpoIrV"
jordanbpeterson,https://t.co/7RA86d9X4m via @YouTube
jordanbpeterson,Childhood mastectomies (read that again) up 389% and @JustinTrudeau appears on Canada's Drag Race https://t.co/mqzOC3DtmY
jordanbpeterson,NSW floods: Macquarie Marshes revived after three consecutive La Ninas https://t.co/rSeBwuyfMR
jordanbpeterson,"""some of the models"""
jordanbpeterson,They never quit.
jordanbpeterson,The conservatives should hang their heads in shame for supporting this appalling Net Zero policy.
jordanbpeterson,More university corruption: hiw is that even possible @JonHaidt
jordanbpeterson,Thank you sir... I hope everyone benefits as much as I did from the seminar @wokal_distance
jordanbpeterson,Trudeau's biggest accomplishment--so far @JustinTrudeau
jordanbpeterson,Yes.
jordanbpeterson,:)
jordanbpeterson,Not narcissists. Genocidal murderers.
jordanbpeterson,Thank you Food Pyramid.
jordanbpeterson,The chickens come home to roost. Yet again.
jordanbpeterson,Adelaide tonight before the lecture and Q and A https://t.co/SgvcxZUidq
jordanbpeterson,"On https://t.co/FB3bvn3oEm thank you to my readers, viewers and listeners: https://t.co/0RFmZjoIeW https://t.co/RTAUpX1zPr"
jordanbpeterson,But we've made such progress on the DIE front @JustinTrudeau
jordanbpeterson,Run away from this.
jordanbpeterson,https://t.co/s54c4urR1c
jordanbpeterson,REVEALED: Brave Queen battled 'painful' cancer for more than a YEAR before her death - 'No self pity' https://t.co/3XUceXbPfU
jordanbpeterson,Good thing we're blocking LNG production to feel good about ourselves undeservedly because otherwise China could turn to something cleaner...
jordanbpeterson,"""simply be declaring themselves so"": that will work out brilliantly for the psychopathic predators who want access to women at their most vulnerable."
jordanbpeterson,"Here's what it means, apparently, although I defy anyone to extract a word of sense from this. Heaven protect us from virtue-signaling women with faux Master's degrees. Master's of Miss Education: https://t.co/znlSR0Ta31"
jordanbpeterson,What the hell does any of this mean?More stupidity on your watch @JustinTrudeau unsurprisingly. Precisely the jargon-ridden feel-good pseudo-communication that you have mastered and embody. https://t.co/61NimqFj5b https://t.co/7al2YvE49j
jordanbpeterson,This what failure looks like to the left @elonmusk
jordanbpeterson,This seems exceptionally promising: https://t.co/L1b8dK7qND
jordanbpeterson,"And it only cost $60,000 per year! Manhattan pharma heiress says she had to unlearn crazed woke views https://t.co/EBBykXibNo via @MailOnline"
jordanbpeterson,Is something up in China? Have they finally had enough of the damnable CCP?
jordanbpeterson,How could this possibly go wrong?
jordanbpeterson,Brought to you by the true friends of humanity at the NY Times: https://t.co/3mfQfSOv4m
jordanbpeterson,"Bigots, misogynists and racists. Right @JustinTrudeau ?"
jordanbpeterson,"Someone should learn a bit more about symbolic representation, methinks: (take note @PageauJonathan):  https://t.co/kCkACIlqC3"
jordanbpeterson,Obviously. We panicked cowardly when facing a vague threat and instantly and near-universally imitated a terrible totalitarian state.
jordanbpeterson,This is fun too: https://t.co/LzdFgJSQJK.
jordanbpeterson,Fancy that: https://t.co/SHjCz82I8r
jordanbpeterson,The top 10 most-regretted college majors — and the degrees graduates wish they had pursued instead https://t.co/wtpMs5vmga
jordanbpeterson,"""enormous, effective strength"" says the tyrant"
jordanbpeterson,Aiding obvious narcissists in further deluding confused young people: our moral leader @JustinTrudeau patting himself on the back for doing so.
jordanbpeterson,"Excess deaths, courtesy of climate moralizers."
jordanbpeterson,130000 subscribers makes them equivalent to a relatively lightweight YouTube influencer. And they overspend $1 million per week. End the subsidies to @TorontoStar and all dysfunctional legacy media. No gov't/media collusion.
jordanbpeterson,Mostly a therapist should listen. A person can straighten themselves out to a great degree if someone listens hard enough while they formulate their thoughts and organize their psyches and lives.
jordanbpeterson,"Complete with now morally-laudable mandatory discriminatory quotas. Part of the replacement of all merit, particularly on the creative front, with envy-driven identity claims. Are you attending, creative artists? This threatens you in the most paramount manner. https://t.co/DiQE526tSG"
jordanbpeterson,Your taxpayer dollars at work: enabling narcissists claiming victimization to elevate their status and influence.
jordanbpeterson,Welcome to CCP world. We could have it here. And maybe we will @HillelNeuer
jordanbpeterson,Last night in Melbourne on the Beyond Order tour: 13000 jointly contemplating rule 12: be grateful in spite of your suffering https://t.co/EPVLHTFyYu https://t.co/f79tideMNv
jordanbpeterson,Let's just criminalize the whole damn thing and get it over with (but maybe watch this first https://t.co/TF3mZAdh4K)
jordanbpeterson,"It's climate ""change"" not ""global warming."" Follow the science, mate! @BjornLomborg"
jordanbpeterson,"Climate zealots love neither the climate nor the poor. They merely hate the rich (rich defined as ""anyone with more than me""). You can tell this by their eagerness to make the poor even poorer, with high energy costs."
jordanbpeterson,"Why? Lawful free market capitalism. Full stop. If you love the poor, then you're pro free-market. If you really want the poor to stay poor (""those nouveau riche: so tacky""), then adopt the radical leftist chic stance."
jordanbpeterson,"Just imagine how we'd all get along ruled by Kamala Harris @VP Happy, overgrown kindergarten toddlers, guided by our mother (who knows deep in her loving heart that we're really not that bright)."
jordanbpeterson,Very funny @ZubyMusic and oh so true.
jordanbpeterson,I wouldn't celebrate yet @rupasubramanya: there are many Canadians who derived the meaning of their lives from their compliance.
jordanbpeterson,"""Zero"" anything: a marker of thoughtless   ill-informed virtue signalling on behalf of the political class."
jordanbpeterson,Keep that population down. Poor people go first.
jordanbpeterson,It's a back-projection of the positive Great Mother archetype on to a fictionalized Native American culture. For more info read the great Erich Neumann: intro here: https://t.co/8DbkX0PraS
jordanbpeterson,How about the damnable Faculties of Education?
jordanbpeterson,"You don't ""demand"" anything. Only those who can say ""no"" can negotiate. You weren't even man enough to ""demand"" a cabinet position in return for your de facto coalition gov't. You're a worse poseur than @JustinTrudeau @theJagmeetSingh"
jordanbpeterson,"While failing utterly and wastefully to ""save the planet."""
jordanbpeterson,Documentary launching this week on DWPlus: Logos &amp; Literacy | Official Trailer https://t.co/TF3mZAdOUi via @YouTube
jordanbpeterson,A challenge: I bet the Bablyon satirists can't top this: @Babbling_Bear_ @Babbling_Beaver @TheBabylonBee
jordanbpeterson,Has @JustinTrudeau been following what's happening with the Tavistock clinic lawsuits? https://t.co/F9GxjvnMpX Doesn't he think there's a problem there? Can't he see that his unspeakably narcissistic virtue-signaling is damaging impressionable adolescents (particularly girls)?
jordanbpeterson,"If don't think this is unfair, consider that 20 million people die/YEAR because of indoor air pollution. Why isn't this an issue? If a fraction of that number were  dying from ""climate change,"" the headlines would proclaim it nonstop. But these 20 million somehow don't matter."
jordanbpeterson,"This is partly because the climate fascists don't actually care about actual people actually dying. They care about hypothetical people dying in some faraway future, in precisely the manner that suits their narcissistically self-serving utopian delusion @BjornLomborg"
jordanbpeterson,Indigenization: the replacement of hardworking and genuinely expert scholars and scientists by narcissistic Machiavellians who pretend to believe simplistic delusional ideological fantasies about what native people once hypothetically believed. https://t.co/4zbhS1VOko
jordanbpeterson,"More fascist collusion: this time from our great friends the banks: for shame, CEOs: https://t.co/0vsei8sSxP"
jordanbpeterson,No none is ever more concerned than @JustinTrudeau
jordanbpeterson,This @nandoodles (how cloyingly cute) is reputation-savaging cancel Queen...
jordanbpeterson,Can't the pharmaceutical companies do their own goddamn advertising?
jordanbpeterson,"No pets to comfort you, peasants, while you freeze and starve in the dark."
jordanbpeterson,"And then the poor are rich. And, apparently, we can't have that."
jordanbpeterson,Europe needed to start fracking ten years ago. But better late than never.
jordanbpeterson,There definitely has to be an evil cabal responsible for levying such accusations :) @KonstantinKisin
jordanbpeterson,The newest entrant into the surreally expanding ranks of conservative student satirists--this time at my alma mater McGill: introducing The Babbling Martlet: https://t.co/YjK2jOcVX0
jordanbpeterson,"Trudeau throws the police under the bus to justify his ""emergency"" @JustinTrudeau"
jordanbpeterson,Backstage Melbourne before tonight's lecture/Q andA with Tina Arena @tinaarena and Mattias Lindblom @mattiaslindblom https://t.co/BHVJp7dJzz
jordanbpeterson,"Fasces are ""bound together.""
That's the meaning. Government/media collusion is technically &amp; essentially fascist. Add corporate collusion into the mix &amp; the conditions are right for a perfect storm. This is what (for example) @rustyrockets rails against, as a genuine leftist."
jordanbpeterson,"""just"": it's always the fundamental fight @elonmusk and its victory always tantamount to a miracle"
jordanbpeterson,What are we waiting for in the West? We took our cues from the CCP before. Start the building now!
jordanbpeterson,"Only @CBCNews is news. And, of course, the other legacy media fascist collusionists who exist on government handouts."
jordanbpeterson,Because the stunningly obvious apparently now needs repetition
jordanbpeterson,"""acknowledged"""
jordanbpeterson,"She figured it out! One of @JustinTrudeau's more perspicacious ministers, apparently."
jordanbpeterson,Unhappiness=trait neuroticism
jordanbpeterson,Seems likely. The conservatives should try conservatism and see how that works.
jordanbpeterson,Why has this only become an issue since @elonmusk actually decided to do something about it? @michaelmalice
jordanbpeterson,"Those ""experts"": always saying."
jordanbpeterson,Visited sculptor Peter Schipperheyn's Melbourne studio today https://t.co/wUcX07RKU3 Remarkable capacity to capture emotion in stone https://t.co/hMtg1tl7YF
jordanbpeterson,"Fancy that: Wildfire Season in U.S. West Ends With Fewer Blazes, Less Damage - WSJ https://t.co/4A5kdTX13l"
jordanbpeterson,"Drive energy costs down. Aid those in absolute poverty by doing so. As a side benefit? Help ""save the planet."""
